company name,category,based in,tags,total funding,founded,website,company status
Talsec,Czechia,Brno,"Computer, Network Security, FinTech",Between €500K-€ 1 million,2021,https://www.talsec.app/,Active
Talu,Ireland,Ireland,"fashion brand, educational hub, Fashion",No funding announced yet,2022,https://talu.earth/,N/A
Tam Analyst,Bulgaria,"Sofia, Bulgaria","Market Analysis,Real-Time Data",Between €500K-€ 1 million,2019,https://tamanalyst.com/,Active
Tamanna,UK,London,"Beauty, Fashion, Internet, Retail, Sales",No funding announced yet,2020,https://www.tamanna.com/,N/A
Tamcalc,Ireland,Dublin,"SaaS, Market Research, Business Intelligence, Data Analytics",No funding announced yet,2023,https://www.tamcalc.com/,Active
Tame,Denmark,Copenhagen,"Event Tech, End-to-end Event Platform, Project Management, SaaS",N/A,2016,www.tame.events,N/A
Tamedai,Germany,Essen,BigData,Between €1-€100K,2019,https://www.tamed.ai/,Active
Tandem,Germany,Berlin,"Language, App, Mobile, Tandem",N/A,2015,https://www.tandem.net/,N/A
Tandemhr,Ireland,Dublin,"remote, employees, Digital employee",Between €1 million-€ 2.5 million,2016,https://www.ourtandem.com/,N/A
Tandemhr Solutions,Ireland,Dublin,"Computer, Software",Between €1 million-€ 2.5 million,2016,https://www.ourtandem.com/,N/A
Tanfit,Netherlands,Amsterdam,"Fitness, Online Portals, Stronger",No funding announced yet,2017,https://www.tan-fit.com/,N/A
Tangany,Germany,Munich,"Blockchain, Cryptocurrencies, Bitcoin, Cryptography, Technology, Internet, Fintech, Wallets, Private Key Storage, Node Infrastructure, Made in EU, Wallet as a Service, and Wallet Service",N/A,2020,https://tangany.com/,N/A
Tangem,Switzerland,Zug,"Blockchain, Cryptocurrency, Electronics, FinTech, Security, Semiconductor",Between €10 million-€25 million,2017,https://tangem.com,N/A
Tangent,UK,London,"Digital Consulting, Serverless Architechture, Visual Design, Branding",Between €500K-€ 1 million,2004,https://tangent.co/,Active
Tangerine,Germany,Munich,"Health Care, Mobile Apps, Personal Health, Wellness",No funding announced yet,2019,http://tangerine.app,N/A
Tanglegence,Ireland,Dublin,"Consulting, Information Tehnology, Strategies",No funding announced yet,2020,https://tanglegence.com/,N/A
Tanit,UK,London,"Regenerative Agriculture, Ecosystem Design, AI",Between €100K-€500K,2023,https://tanit.solutions/,Active
Tanker,France,Paris,"Cloud Security, Developer Platform, Identity Management, PaaS, Privacy, Software",Between €2.5 million-5 million,2015,https://www.tanker.io/,N/A
Tankyou,France,Paris,"Clean Energy, Delivery, E-Commerce",Between €500K-€ 1 million,2016,https://tankyou.com,N/A
Tannico,Italy,Milano,"FoodTech, Wine Shop, eCommerce",N/A,2012,www.tannico.it,N/A
Tanqyou,Netherlands,Franeker,"Fintech, Start-up, MaaS, innovative",Between €5 million-€10 million,2016,TanQyou.com,N/A
Tanso,Germany,Munich,"Carbon accounting, software, sustainability management",Between €5 million-€10 million,2021,https://www.tanso.de/,Active
Tantalum Corporation,UK,Uxbridge,"Automotive, Information Technology, Recreational Vehicles, Service Industry",Between €10 million-€25 million,2014,http://www.tantalumcorporation.com/,N/A
Tantric Circle,UK,London,"Internet, Digital, Marketing, Shop, eCommerce",No funding announced yet,2020,https://tantriccircle.com,N/A
Tao,UK,London,"Mobile Appliction Development, Andriod Development, Viral Content Marketing, Amazon AWS",No funding announced yet,2019,https://www.taoapp.me/,N/A
Tao Climate,Ireland,Dublin,"Environment, Health & Wellness, Restoration Services, B2B",Between €100K-€500K,2022,https://taoclimate.com/,Active
Tap Electric,Netherlands,Amsterdam,Microsoft Exchange Online Content Management System Email Hosting Service,Between €1 million-€ 2.5 million,2020,https://www.tapelectric.app/,Active
Tap My Back,Portugal,Lisbon,"HR Tech, Employee Recognition, Evaluation Software",N/A,2012,https://www.tapmyback.com/,N/A
Tap2Pay,Poland,Białystok,"Finance, Payment System Provider, Chatbot, Mobile, and Messenger",N/A,2017,http://tap2pay.me,N/A
Tape It,Germany,Berlin,Music,No funding announced yet,2021,https://tape.it,N/A
Tapio,Belgium,Brussels,"Environmental Consulting, Information Technology, Software",Between €500K-€ 1 million,2019,http://www.tapioview.com/,N/A
Tapkey,Austria,"Vienna, Austria","Smart Home, Smart Keys, Locking Devices",N/A,2014,www.tapkey.com,N/A
Tapline,Germany,Berlin,FinTech,Between €100K-€500K,2021,https://tapline.io/,N/A
Taplingua,Spain,Madrid,"Education, Language Learning, Video",No funding announced yet,2018,http://www.taplingua.com,N/A
Tapmedia,UK,London,"Mobile App Development, mobile apps",No funding announced yet,2016,http://www.tapmedia.co.uk,N/A
Tapnation,France,Paris,"games, adventure, hard-working, fun team",No funding announced yet,2019,https://www.tap-nation.io/,N/A
Tapp,Netherlands,Amsterdam,"Food and Beverage, Hospitality",Between €1 million-€ 2.5 million,2015,https://tapp.cafe,N/A
Tapp Water,Spain,Barcelona,"tap, filter, sustainable",N/A,2015,tappwater.co,N/A
Tappable,Belgium,Brussels,"Advertising, Information Technology, SaaS, Software",No funding announced yet,2019,https://tappable.co,N/A
Tappcard,Bulgaria,"Sofia, Bulgaria","tappcard, digital business card, electronic business card",No funding announced yet,2024,http://tappcard.co/,Active
Tappx,Spain,Barcelona,"AdTech, Monetization Solution, AI Algorithms",N/A,2014,tappx.com,N/A
Tappy,UK,Stockholm,"Apps, E-Commerce, Food and Beverage, Internet, Mobile, Mobile Apps, Social Media, Software",No funding announced yet,2020,https://tappy.co,N/A
Tapqio,Italy,Vicenza,"restaurant management, table management, bar ownership",No funding announced yet,2023,https://beta.tapq.io/,Active
Taprefer,Germany,Berlin,"Affiliate marketing, Sales, Marketing",Between €1-€100K,2023,https://taprefer.com,Active
Taptap Send,UK,London,"fintech, Financial services",Between €10 million-€25 million,2018,https://www.taptapsend.com/,N/A
Taptrip,UK,Manchester,"SaaS, Travel, Hospitality",Between €2.5 million-5 million,2018,https://taptrip.com/,N/A
Tapup,Belgium,Kortrijk,SaaS,Above €25 million,2022,https://www.tap-up.app/,Active
Tarbh Tech Limited,Ireland,Limerick,"Cybersecurity, Secure networking, Secure cloud",No funding announced yet,2018,https://tarbh.tech,N/A
Targomo,Germany,Potsdam,"location intelligence, interactive maps, geo visualization",No funding announced yet,2014,https://www.targomo.com/,N/A
Targtex,Portugal,Torres Vedras,"Artificial Intelligence, Health Care, Pharmaceutical",No funding announced yet,2019,https://targtex.com/,N/A
Taruga Creaciones,Spain,San Javier,"Art, E-Commerce, Home Decor, Marketplace",Between €1-€100K,2018,https://tarugacreaciones.com,N/A
Task Analytics,Norway,Oslo,"methodology, Analytics, user testing",No funding announced yet,2016,https://www.taskanalytics.com/,N/A
Taskeo,Estonia,Global; HQ in Tallinn,"project management, collaboration, crm, legal tech",N/A,2018,https://taskeo.co/,N/A
Tasker Army,Spain,Barcelona,"Advertising Services, Web Development, Graphic Design, Copywriting",Between €1-€100K,2022,https://taskerarmy.com,Active
Tasklane Technology,UK,London,"AI, Real Estate",Between €1 million-€ 2.5 million,2023,https://www.tasklane.app/,Active
Taskomat,Italy,Tavullia,"Software, Web Development, Project Management Tool",Between €1-€100K,2016,https://taskom.at/,N/A
Tasman Global,Netherlands,Amsterdam,"Consulting, Electronic Health Record, Information Technology",No funding announced yet,2016,https://www.tasmanglobal.com/,N/A
Tasquitos Freelance Marketplace,Hungary,Nagykozar,"freelance,freelancing,marketplace,content",No funding announced yet,2021,https://tasquitos.com/,N/A
Taste It,Spain,Madrid,"Internet Publishing, Advertising, Grocery, Marketing",Between €100K-€500K,2021,https://tasteit.es/,Active
Taste Italy,Italy,Bologna,"E-Commerce, Health Care, Retail",Between €2.5 million-5 million,2015,http://www.taste-italy.it/,N/A
Taste Of Kenya,Ireland,"London, UK","Marketplace, Coffee Trading Platform, FarmTech",N/A,2013,www.tasteofkenya.org,N/A
Tastea,Netherlands,Beek,"E-Commerce, Food and Beverage, Tea",No funding announced yet,2016,https://www.tastea.eu/,N/A
Taster,France,France,"Food, Takeaway, Sustainability",N/A,2017,https://www.taster.com/,N/A
Tastingin,Spain,"Sojuela, La Rioja","Virtual Tastings, Marketplace",No funding announced yet,2020,http://tastingin.com/,N/A
Tatankanl,Netherlands,Amsterdam,"natural supplements, herbal supplements, mood enhancers, energy boosters, relaxation aids, responsible use",No funding announced yet,2023,https://www.tatanka.nl/,Active
Tate,Italy,Florence,"Apps, Transparent, Digital",No funding announced yet,2018,https://tate.it/,N/A
Tatovering For Deg,Norway,Jaren,"tatovering, klinikk, ny tatovering",No funding announced yet,2021,https://tatoveringfordeg.no/,N/A
Tattoodo,Denmark,Copenhagen,"Tattoo Culture, Social Network, Tattoo Artist Community",N/A,2013,https://www.tattoodo.com/,N/A
Tattoos Wizard,UK,London,"find, tattoo, artists, studios",N/A,2020,https://tattooswizard.com/,N/A
Tattoox,Spain,Barcelona,"Artist, Technology, Information, Internet",Between €100K-€500K,2021,https://www.tattoox.io/,Active
Tatuing,Spain,Valencia,"Tatoo, App, tattoo studios",No funding announced yet,2018,http://www.tatuing.com/,N/A
Tatum,Czechia,Brno,"Banking, Blockchain, Developer APIs, Developer Platform, PaaS, Pharmaceutical, Smart Building, Smart Cities, Supply Chain Management",No funding announced yet,2018,https://tatum.io,N/A
Tau Group,Italy,Torino,"Automotive, Clean Energy, Electric Vehicle, Manufacturing, Renewable Energy, Transportation",Between €10 million-€25 million,2014,https://www.tau.group,N/A
Taught By Humans,UK,Bristol,"AI & Data Literacy Training, Human-Centered Learning, Practical Implementation Support",Between €100K-€500K,2023,https://www.taughtbyhumans.com/,Active
Taur,UK,London,"electric scooters, electric vehicles, micromobility",N/A,2019,https://www.taur.com/,N/A
Taut,Estonia,Estonia,"education, edtech",Between €1-€100K,2020,https://tautapp.co,N/A
Tavan,Bulgaria,Sofia,"machine learning, mobile app, fitness",Between €100K-€500K,2019,https://tavan.app/,N/A
Tawny,Germany,Munich,"Artificial Intelligence, Consulting, Digital Marketing, Human Computer Interaction, Information Technology, Machine Learning, Market Research, SaaS, Software, UX Design",No funding announced yet,2017,https://tawny.ai/,N/A
Tax Helper,Denmark,Copenhagen,"Financial Services, Tax Service, App, Platform",No funding announced yet,2020,https://taxhelper.dk/,N/A
Taxando,Germany,Berlin,"Accounting, Finance, Financial Services, Software",No funding announced yet,2017,https://taxando.de,N/A
Taxdone,Switzerland,Zurich,"Accounting, Software, Application",No funding announced yet,2020,https://www.taxdone.ch,N/A
Taxdoo,Germany,Hamburg,"E-Commerce, Finance, Financial Services, FinTech",Between €10 million-€25 million,2016,https://www.taxdoo.com/,N/A
Taxdown,Spain,Madrid,"crypto, tax, saas",Between €5 million-€10 million,2019,https://www.taxdown.es/,N/A
Taxfix,Germany,Berlin,"taxes, income, tax return",N/A,2016,http://taxfix.de,N/A
Taxi2Share,Belgium,Brussels,"Sharing Taxi, TravelTech, Mobility",N/A,2004,http://www.taxi2share.eu,N/A
Taxibeat,Greece,Athens,"Taxi Management Software, Mobility, Transportation",N/A,2011,http://www.taxibeat.com,N/A
Taxicoin,Spain,Vitoria,"Apps, Blockchain, Tax Service, Technology",Between €1-€100K,2022,https://taxicoin.app/,Active
Taxinsight,Poland,Warsaw,"finances, tax, ksef",Between €1 million-€ 2.5 million,2023,https://taxinsight.pl/,Active
Taxly,Switzerland,Zurich,"TaxTech, RegTech, Tax Calculator",N/A,2019,www.taxly.ch,N/A
Taxnav,UK,Cambridge,"Tax Prep, Tax, Accounting, Finance Technology, Software, SaaS, Software As A Service, Finance, B2C, Financial",No funding announced yet,2023,https://www.taxnav.digital,Active
Taxnology Innovations,Hungary,Budapest,"accounting services, tax system, taxation",No funding announced yet,2017,https://taxnologyinnovations.hu/,N/A
Taxscouts,UK,London,"FinTech, Tax Platform, Personal Accountant",N/A,2017,www.taxscouts.com,N/A
Taxtastic,Austria,Atzgersdorf,"IT Services, IT Consulting, Apps, Taxi Service",No funding announced yet,2020,https://taxtastic.at,Active
Taxtris,UK,London,"Web3 economy, crypto tax obligations, API-first tax automation",Between €1 million-€ 2.5 million,2022,https://www.taxtris.com/,N/A
Tbee,Portugal,Sequeira,"E-Commerce, Network Hardware, Video games",No funding announced yet,2016,https://www.tbee.com/,N/A
Tbh,UK,London,"Candidate Evaluation, Interview Feedback Assessments, Candidate Assessments, Interview Evaluation,",No funding announced yet,2024,https://tobehonest.io/,Active
Tbiom,Spain,Sant Adria de Besos,"sleep, device, apnea",N/A,2015,www.yourairmony.com,N/A
Tbook,Romania,Cluj-napoca,"book sharing, app, cryptocurrency",No funding announced yet,2022,https://tabook.io/classic/,N/A
Tcg,UK,Leeds,"Collectibles. Financial Services, Software",No funding announced yet,2020,https://www.tcgprice.com/,N/A
Tchek,France,Paris,"Automotive, Car Rental, AI, Mobility",Between €2.5 million-5 million,2016,www.tchek.fr,N/A
Tcr App Mobility,Poland,Warsaw,"road traffic accidents, biometric, deep neural networks",Between €100K-€500K,2022,https://www.tcrapp.tech/,Active
Tcxa,Netherlands,Amsterdam,"Advertising, Digital Marketing, Customer Service",No funding announced yet,2018,https://tcxa.online/,N/A
Tea Set Box,UK,Salford,"tea set, teacup, teapot",No funding announced yet,2020,https://www.teasetbox.com/,N/A
Teachablehub,Bulgaria,Sofia,"Artificial Intelligence, Cloud Computing, Cloud Data Services, Cloud Infrastructure",No funding announced yet,2020,http://www.teachablehub.com,N/A
Teachcorner,Italy,Milan,"Education, Internet, Peer to Peer",Between €1-€100K,2019,https://www.teachcorner.com/,N/A
Teacher Hug Radio,UK,London,"Broadcasting, Education, Internet Radio",Between €1-€100K,2021,https://teacherhug.co.uk,N/A
Teacherbot,UK,Glasgow,"ai,teachers,education",No funding announced yet,2021,https://teacherbot.io/,N/A
Teacherly,UK,London,"E-learning, Teachers, Teaching, Platform, London",N/A,2015,https://teacherly.io/,N/A
Teachers Lead Tech,Lithuania,Vilnius,"E-Learning, Education, technology creativity, IT skills",No funding announced yet,2019,https://www.teachersleadtech.com/en/,N/A
Teachkloud,Ireland,Cork,"edTech, Education, Pre-school Management System, Cloud, TeachKloud, Cork",N/A,2016,https://www.teachkloud.com,N/A
Teachvid,Spain,Elche,"EdTech, Education, Language Learning",No funding announced yet,2019,https://www.teachvid.com,N/A
Teads,France,Paris,"Social Media, Marketing, Video advertising, AdTech, Teads, Paris",N/A,2011,www.teads.com,N/A
Teale,France,Paris,"Health Care, Mental Health, Digital Health",Between €2.5 million-5 million,2021,https://teale.io/,N/A
Team Activities,Ireland,Dublin,"Casual Games, Event Management, Events, Gaming, Online Games",No funding announced yet,2020,https://www.teamactivities.com/,N/A
Team Analytics,Estonia,Tallin,"employee engagement, employee feedback, survey, employee retention",N/A,2019,www.team-analytics.com,N/A
Team Cyclis,Belgium,Lommel,"Leasing, Rental, Service Industry",Between €100K-€500K,2014,https://www.cyclis.be,N/A
Team Odeon,Cyprus,Limassol,"Affiliate Marketing, Higher Education, Publishing, SEO",Between €100K-€500K,2020,https://www.teamodeon.com,N/A
Team Password Manager,Spain,Barcelona,"Password Manager, HR Tech, Cybersecurity",N/A,2011,http://teampasswordmanager.com,N/A
Team Red Panda,Slovenia,Ljubljana,"Gaming, Non Profit",Between €1-€100K,2016,http://teamredpanda.com/,N/A
Team Today,UK,Manchester,"Office Administration, Remote Work, Hr",No funding announced yet,2021,https://team-today.com,N/A
Team4Solution,Cyprus,Limassol,Delivering Beautiful Digital Products,N/A,2014,https://team4solution.com/,N/A
Teamdifferent,Italy,Bari,"mental health, corporate well-being, psychological support",No funding announced yet,2022,https://teamdifferent.it/,N/A
Teamecho,Austria,Linz,"SaaS, HR Tech, b2b, Leadership",Between €1 million-€ 2.5 million,2015,www.teamecho.com,N/A
Teamed,UK,London,"HR, Employment, software",Between €2.5 million-5 million,2018,www.teamed.global,N/A
Teameq,Spain,Barcelona,"saas, team, performance",N/A,2016,https://www.teameq.net,N/A
Teamflect,UK,"Greater London, London","Employee Engagement, Performance Management, Employees",No funding announced yet,2018,https://teamflect.com,N/A
Teamgate,UK,London,"CRM, Sales Stack,",N/A,2013,https://www.teamgate.com,N/A
Teamgeist,Germany,Munich,"Fitness, Sports, Athletic",Between €100K-€500K,2019,http://teamgeist.app,N/A
Teamgrid,Germany,Berlin,"Apps, Collaboration, Project Management, SaaS, Software",No funding announced yet,2017,https://teamgridapp.com,N/A
Teamhood,Lithuania,Vilnius,"project management, task management",No funding announced yet,2020,https://teamhood.com,N/A
Teamixo,UK,Exeter,"workforce, management, SaaS",No funding announced yet,2023,https://teamixo.com,Idea Stage
Teamleader,Belgium,Ghent,"HR Tech, CRM, Invoice Management, Project Management",N/A,2012,www.teamleader.eu,N/A
Teamopipe,Latvia,Rīga,"CRM, sales management, customer relationship management",No funding announced yet,2023,https://www.teamopipe.com/,Active
Teamoty,France,Morestel,"planning, schedules, actors, real-time",No funding announced yet,2018,https://www.teamoty.io/,N/A
Teamscope,Estonia,"Tallinn, Harjumaa","Analytics, Artificial Intelligence, Big Data, Human Resources, Recruiting",Between €1 million-€ 2.5 million,2015,/cdn-cgi/l/email-protection,N/A
Teamsportz,UK,London,"tracking, athletes, sports teams, performance",N/A,2018,www.teamsportz.pro,N/A
Teamstack,Austria,Vienna,"Identity Management, IT, Software, Software Company",No funding announced yet,2019,https://www.teamstack.com,Active
Teamsuccess,Finland,Helsinki,"Information Technology, Risk Management, Software Engineering",No funding announced yet,2019,https://teamsuccess.io,N/A
Teamtailor,Sweden,Stockholm,"HR Tech, Recruitment, SaaS, Teamtailor, Stockholm",N/A,2013,https://www.teamtailor.com/en/,N/A
Teamtelefoon,Netherlands,Rotterdam,"Health Care, Telecommunications, Techology",No funding announced yet,2016,https://teamtelefoon.nl/,N/A
Teamtonic,France,Paris,"Design, Freelance, On-demand design experts",No funding announced yet,2021,https://www.teamandtonic.com/,Active
Teamway,Denmark,Copenhagen,"hire, remote, team, workers, freelance, talents",Between €2.5 million-5 million,2020,https://teamway.io/,N/A
Tebeox,Spain,Valencia,"Comics, Digital Entertainment, Mobile Apps",No funding announced yet,2018,https://tebeox.com,N/A
Tebo,Estonia,Tallinn,"e-Learning, EdTech, Learning Content, Digital Teacher Assistant",N/A,2014,www.tebo.me,N/A
Tec4Med,Germany,Darmstadt,"Clinical Trials, Home Services, Logistics, Packaging Services",No funding announced yet,2017,https://nelumbox.com/home_en-2/,N/A
Tecfrac,Spain,Marbella,"Cloud Security, Developer APIs, Mobile Apps, Software",No funding announced yet,2018,https://www.tecfrac.com,N/A
Tech Alchemy,UK,London,"Mobile Apps, Software, Web Development",No funding announced yet,2016,http://www.techalchemy.co,N/A
Tech Fortune,Romania,Bistri?a,"Machine Learning, HR, Recruitment",N/A,2017,https://www.azzurehr.com,N/A
Tech Jobs Berlin,Germany,Berlin,"tech jobs, job board, Berlin, HR",N/A,2019,https://techjobsberlin.co/,N/A
Tech Kivuhub,UK,LONDON,"IT, CYBER SECURITYM TECHNOLOGY",No funding announced yet,2024,https://tech.kivuhub.net/,Active
Tech Noco,Poland,Varshava,"Startup, Professional Services, Consulting, Technology",Between €1-€100K,2019,https://www.tech-noco.com/,Active
Tech Results,UK,Oxted,"managed service provider, msp, managed it services",No funding announced yet,2019,https://www.techresults.co.uk/,N/A
Tech To The Rescue,Poland,Warsaw,"NGO's, tech, sustainability",Between €1 million-€ 2.5 million,2021,Techtotherescue.org,N/A
Tech Wave Hires,UK,UK,HR,Between €1-€100K,2024,https://www.techwavehires.com/,Active
Tech Will Save Us,UK,London,"EdTech, Kids Tech, Tech Games, Toys",N/A,2012,www.techwillsaveus.com,N/A
Tech11,Germany,Würzburg,"Information Technology, Insurance, Security",No funding announced yet,2018,https://tech11.com,N/A
Tech2B,Netherlands,Bladel,"saas, platform, multi-sided",Between €1 million-€ 2.5 million,2019,tech2b.cc,N/A
Tech2Com,Netherlands,Amstelveen,"E-Commerce, Wholesaler, Employees",No funding announced yet,2021,https://tech2com.com/,N/A
Tech2Impact,Austria,Vienna,"Think Tanks, Startup Mentorship, Impact Tech, Consulting",No funding announced yet,2020,https://tech2impact.com/,Active
Techacute,Germany,Frankfurt am Main,"Media, News, Tech",No funding announced yet,2014,https://techacute.com/,N/A
Techaway,Spain,Barcelona,"Tech, rent, IT",Between €1-€100K,2022,https://www.techaway.es,N/A
Techaway Technologies,Spain,Barcelona,"Computer, Information Technology, Rental",No funding announced yet,2022,https://techaway.es,N/A
Techbehemoths,Germany,Berlin,"Business Information Systems, Classifieds, Digital Media, Information Technology",No funding announced yet,2019,https://techbehemoths.com,N/A
Techbros,Germany,Düsseldorf,"IoT, IT, telecommunication hardware",N/A,2018,https://www.techbros.io,N/A
Techbuddy,Sweden,Stockholm,N/A,N/A,2016,www.techbuddy.co,N/A
Techfinder,France,Lyon,"productivity, hiring, recruitment, tool",No funding announced yet,2023,www.techfinder.io,Active
Techiia,Cyprus,Limassol,"Construction, Information Technology, Retail, SaaS, Software, Web Development",No funding announced yet,2019,https://techiia.com/,N/A
Techinvited,Poland,Cieszyn,"automation, autonomy, logistics",No funding announced yet,2021,https://techinvited.pl/en/home-2/,Active
Techlink Innovations,UK,Scotland,"ICT Training, Cybersecurity Solutions, IT Support & Maintanance",No funding announced yet,2024,https://techlinkinnovations.com/,Active
Techmet,Malta,Valletta,"industrial company, technology, metal supply chain, investments",Between €1 million-€ 2.5 million,2017,https://www.techmet.ie/,N/A
Techmet Limited,Malta,Valletta,"industrial company, technology, metal supply chain, investments",Between €1 million-€ 2.5 million,2017,https://www.techmet.ie/,N/A
Technewsreport,Germany,Berlin,"Online Media, Tech News, Digital Magazine",N/A,2012,http://technewsrprt.com/,N/A
Technical Origami,UK,Ilkley,"web development, UI & UX design, mobile app development, digital marketing",No funding announced yet,2022,https://tech-origami.com/,N/A
Technically Compatible,UK,Sunderland,"skills, recruitment, hr, candidates",N/A,2014,www.technicallycompatible.com,N/A
Technidrone,Spain,Noain,"Aerospace, Drones, Industrial Design",Between €1-€100K,2014,https://technidrone.es,N/A
Technis,Switzerland,Lausanne,"Artificial Intelligence, Information Services, Infrastructure",Between €1 million-€ 2.5 million,2016,https://technis.com,N/A
Technocarbon,France,Paris,"Technologies, carbon fiber, cutting-edge technology",Between €100K-€500K,2018,http://tctf.eu/en/,N/A
Technofounders,France,Orsay,Professional Services,Between €5 million-€10 million,2014,http://technofounders.com,N/A
Technological University Dublin,Ireland,Dublin,"Education, Information Technology, Professional Services, Universities",No funding announced yet,2019,https://www.tudublin.ie/,N/A
Technoscore,UK,London,Web development services,No funding announced yet,2006,https://www.technoscore.com/hire-web-developers.html,N/A
Techrivo,Portugal,Lisbon,"foster, innovation, software development, custom software",No funding announced yet,2022,https://techrivo.com/,N/A
Techsalesbox,Ireland,Cork,"communication, ROI, B2B, sales, fees",No funding announced yet,2017,https://techsalesbox.com/,N/A
Techschweiz Software Solutions Gmbh,Switzerland,Baar,"AI transformation, Software Engineering, Technology",No funding announced yet,2023,https://techschweiz.com/,Active
Techspace,UK,London,"workspace, community, ecosystems, London",N/A,2011,http://www.techspace.co/,N/A
Techstar,Italy,Udine,"Artificial Intelligence, Information Services, Information Technology",Between €1-€100K,2021,https://www.techstar.it/,N/A
Techstep Asa,Norway,Oslo,"mobile technology, mobile devices, smart tools",No funding announced yet,2016,https://www.techstep.no/,N/A
Techstory,Austria,Vienna,"marketing, communication, agile marketing",N/A,2019,https://www.techstory.at/,N/A
Techstream Group,UK,London,"Staffing Agency, Information Technology, Marketing",No funding announced yet,2021,http://www.techstreamgroup.com/,N/A
Techteamfinder,Netherlands,The Hague,"Career, Recruitment, Startup, Business",No funding announced yet,2024,https://techteamfinder.com/,Active
Techtron,UK,Bradford,"technology, delivery, Retail",No funding announced yet,2022,https://www.techtron.co/,N/A
Techugo,Poland,"Warsaw , Mazovia","technology, development, application,android, ios, software developer,",N/A,2015,https://www.techugo.com/,N/A
Techvantage,Germany,Obermeitingen,"analytics, AI, machine learning",N/A,2017,https://www.techvantage.de/,N/A
Techvision Fonds,Germany,Aachen,"funds, startups",No funding announced yet,2020,techvision-fonds.de,N/A
Techwald,Italy,Milan,"Financial Services, Information Technology, Insurance",No funding announced yet,2017,https://www.techwald.com/,N/A
Techwich,Spain,Barcelona,"Free Tech Courses, Professional Certification, Mobile Learning",Between €100K-€500K,2022,https://techwich.org,Active
Techwolf,Belgium,Ghent,"Artificial Intelligence, Software Development, Automatic",Between €1 million-€ 2.5 million,2018,https://techwolf.ai/,N/A
Techxenium,UK,Mildenhall,"Advertising, IT, Software, Web Design",No funding announced yet,2023,https://www.techxenium.com/,N/A
Teco Global Mobility,Spain,Malaga,"Mobility, Micromobility, Electric Vehicles, Software",No funding announced yet,2022,https://www.tecomobility.com,Active
Tecracoin,Poland,Warsaw,"Blockchain, Science, Graphene",No funding announced yet,2019,https://tecracoin.io/,N/A
