company name,category,based in,tags,total funding,founded,website,company status
Surety,UK,London,"compliance, regulation, regtech",No funding announced yet,2022,https://www.complianceasaservice.com/,N/A
Surfboard,UK,London,"Software, Web Development, workforce",Between €2.5 million-5 million,2023,https://teamsurfboard.com,N/A
Surfboard Payments,Sweden,Stockholm,"FinTech, Mobile Payments, Payments, Software",No funding announced yet,2019,https://www.surfboardpayments.com/,N/A
Surfe,France,Paris,"Workspace, CRM, data",Between €2.5 million-5 million,2020,https://www.surfe.com/,N/A
Surfshark,Spain,Tortola,"Cyber Security, Network Security, Privacy",No funding announced yet,2018,https://surfshark.com,N/A
Surfvacationer,Austria,Vienna,"Booking, surf camps",Between €1-€100K,2021,https://surfvacationer.com/,N/A
Surgaccord,Netherlands,Amsterdam,"Health Care, Medical, Software",Between €1-€100K,2021,https://surgaccord.com,N/A
Surge Cloud,Poland,Poznan,"Analytics, Data Integration, Machine Learning",Between €1 million-€ 2.5 million,2016,https://surgecloud.co/en,N/A
Surge2Surgery,France,Paris,"Artificial Intelligence, Machine Learning, Predictive Analytics",No funding announced yet,2021,https://www.surge2surgery.com,N/A
Surgeonslab,Switzerland,Bern,"medtech, scientist, surgeon, neurosurgery, microsurgeries",Between €1-€100K,2020,https://www.surgeonslab.com/,N/A
Surges,UK,York,"saas, marketing, software, b2b",Between €1-€100K,2020,https://www.surges.co/,N/A
Surgiprint,Belgium,Brussels,"3D, AR, VR",Between €1-€100K,2021,http://www.surgiprint.com,N/A
Surgiq,Italy,Genoa,"Artificial Intelligence, Health Care, Hospital",Between €1 million-€ 2.5 million,2016,https://www.surgiq.com/,N/A
Surguide,Netherlands,Rotterdam,"medical device, cancer surgery, healthtech",N/A,2018,https://www.surguide.nl,N/A
Surmile,Spain,Barcelona,"kids, box, subscription, parents",N/A,2018,https://surmile.com/,N/A
Surplushub International,Norway,Hauge i Dalane,"surplus, marketplace, platform, circulareconomy",No funding announced yet,2015,www.SurplusHub.com,N/A
Surprise My Cat,Spain,Barcelona,"E-Commerce, Snacks, Adventure",No funding announced yet,2020,https://es.surprisemy.cat/,N/A
Surreal Studios,UK,London,"AR, games, puzzles, team, app",N/A,2020,http://www.surrealstudios.co.uk/,N/A
Surrealdb,UK,London,"Big Data, Database, Developer Platform, Developer Tools, Enterprise Software, Software",No funding announced yet,2021,https://surrealdb.com/,N/A
Survais,Ireland,"Cork, Ireland","SaaS, engagement, users",N/A,2017,https://www.survais.com,N/A
Surve Mobility,Germany,Berlin,"Automotive, Car Sharing, Logistics, Software, Transportation",Between €2.5 million-5 million,2017,http://www.survemobility.com,N/A
Survey Anyplace,Belgium,Antwerp,"Survey Tools, Data Collection, Feedback Platform",N/A,2012,https://surveyanyplace.com,N/A
Surveyauto,Netherlands,Amsterdam,"Analytics, Artificial Intelligence, Information Technology",No funding announced yet,2019,http://www.surveyauto.com/,N/A
Surveycircle,Germany,Mannheim,"research, survey, survey participants, participants, free survey participants, get participants",No funding announced yet,2015,https://www.surveycircle.com/,Active
Surveyparrot,Netherlands,Netherlands,"survey, visitors, tool",N/A,2015,https://surveyparrot.com,N/A
Surveysensum,Austria,vienna,"customer feedback, customer experience",No funding announced yet,2018,https://www.surveysensum.com,Active
Survicate,Poland,"Warsaw, Poland",N/A,N/A,2013,http://survicate.com,N/A
Surviot,Hungary,Hatvan,IoT,Between €100K-€500K,2022,https://surviot.com/,Active
Survivor Race,Spain,Valencia,Sports,No funding announced yet,2018,https://survivor-race.com/,N/A
Survser,Spain,Barcelona,"surveys, customer feedback, product management",No funding announced yet,2023,https://www.survser.com,Active
Sushi Bikes,Germany,Munich,"e-bike, urban mobility, mobility",N/A,2018,https://sushi-bikes.com/,N/A
Susphos,Netherlands,Amsterdam,"chemical, recycling",No funding announced yet,2020,https://www.susphos.com/,N/A
Susplus,Portugal,Porto,"Software Development, Eco-Friendly Technologies, Green Innovation, Sustainability Tech",Between €100K-€500K,2024,https://susplus.tech/,Active
Sustaim,Germany,Bad Homburg,"Sustainability ,ReFi ,Carbon Market",No funding announced yet,2022,https://www.sustaim.earth/,N/A
Sustain Online,Finland,Helsinki,"sustainability, b2b, education",N/A,2019,https://www.sustainonline.com/,N/A
Sustainability Champions,UK,London,"sustainability, media, digital events, podcast",No funding announced yet,2020,www.sustainabilitychampions.com,N/A
Sustainabilitysoftwares,Switzerland,Bern,"Sustainability, Software, Directory",No funding announced yet,2024,https://www.sustainabilitysoftwares.com/,Active
Sustainabill,Germany,Cologne,"Information Technology, Software, Supply Chain Management",No funding announced yet,2017,https://sustainabill.de,N/A
Sustainable Buildings,Netherlands,Groningen,"Computer, Software, Management System",No funding announced yet,2016,https://sustainablebuildings.nl/,N/A
Sustainable Space Economy,Finland,Espoo,"Sustainability, Online Platform, spaceeconomy, Collaboration",No funding announced yet,2022,https://sustainable-space-economy.com/,N/A
Sustainable Travel Technologies,UK,Kingston Upon Thames,"Environmental Services, Sustainable, Certified B Corp",Between €100K-€500K,2024,https://sustainabletravel.tech/,Active
Sustainalyse,Lithuania,Vilnius,"ESG, Sustainability, AI, software",No funding announced yet,2024,www.sustainalyse.com,Active
Sustaincert,Luxembourg,Luxembourg,"Innovation Management, Product Design, Retail Technology",Between €5 million-€10 million,2018,https://www.sustain-cert.com/,N/A
Sustainder,Netherlands,Rotterdam,"Electronics, High-Tech, Architecture",No funding announced yet,2016,https://sustainder.com/,N/A
Sustainer Homes,Netherlands,Utrecht,"buildings, co2, modular",N/A,2015,https://www.sustainerhomes.nl/,N/A
Sustainlab,Sweden,Stockholm,"sustainability as a service, SaaS, machine learning, sustainability data analysis",N/A,2020,http://www.sustainlab.co/,N/A
Sustainly,Denmark,Copenhagen,"Purpose, SaaS",Between €1-€100K,2023,https://sustainly.earth/,Active
Sustainotech,Netherlands,Amstelveen,"ESEF iXBRL tagging, ESRS iXBRL, ESG reporting, Sustainability Reporting",No funding announced yet,2023,https://sustainotech.com/,Active
Sustie,Norway,Oslo,"Technology, Information and Internet, e-commerce, fashion",Between €100K-€500K,2022,https://sustie.io/,N/A
Sustonica,Spain,Barcelona,"Hospitality, sustainability, tourism, vacation rentals",Between €100K-€500K,2022,https://sustonica.com,N/A
Susurrus,Greece,Athens,"Influencers, Marketing, PR, Digital Campaigns, Susurrus, Athens",N/A,2014,www.susurrus.io,N/A
Suumbox,Estonia,Tallinn,"Real Estate, Workplaces, Sound Solutions",No funding announced yet,2018,https://myspotit.com/,N/A
Suzan Ai,France,Paris,"Software Development, AI, Automation",Between €100K-€500K,2023,https://suzan.ai,Active
Svadia,Sweden,Stockholm,"Home Decor, Interior design, brass figure, decoration, gifts",Between €1-€100K,2020,https://svadia.se/,N/A
Svea Solar,Sweden,Sollentuna,"Clean Energy, CleanTech, Energy, Energy Efficiency, Energy Management, Energy Storage, Internet of Things, Renewable Energy, Solar",Between €10 million-€25 million,2014,http://www.sveasolar.com/,N/A
Svelta Courier,Cyprus,Limassol,"courier service, last-mile delivery",Between €100K-€500K,2021,www.sveltacourier.com,N/A
Svenry,Sweden,Stockholm,"AI, Risk mitigation, compliance",No funding announced yet,2024,https://www.svenry.com/,Active
Svet,Germany,Berlin,"Ligting Solutions, Smart Light, GreenTech",N/A,2014,http://www.svet.io,N/A
Svexa,Poland,Gdansk,"Wellness, Fitness Services, analytics, genetics",Between €500K-€ 1 million,2018,https://www.svexa.com,N/A
Sviper,Germany,Hamburg,"Mobile Games, Gamification, Sviper, Hamburg",N/A,2016,https://sviper.com,N/A
Svrvive,Sweden,Stockholm,"VR, AR, games",N/A,2016,www.svrvive.com,N/A
Swaarm,Germany,Berlin,"Performance Marketing, Tracking Solution, Marketing Software",Between €500K-€ 1 million,2020,https://swaarm.com/,N/A
Swalife Biotech,Ireland,Cork,"molecules, plants, cosmetics, biotech",No funding announced yet,2017,https://swalifebiotech.com/,N/A
Swan,France,Paris,"Fintech, Financial services",Between €2.5 million-5 million,2019,https://www.swan.io/,N/A
Swan Finance,Estonia,Tallinn,"Artificial Intelligence, Bitcoin, Cryptocurrency, Payments",No funding announced yet,2020,https://swanfinance.io/,N/A
Swanest,UK,London,"FinTech, Wealth Management, Intelligent Investing",N/A,2014,www.swanest.com,N/A
Swanlaab,Spain,Madrid,"Godaddy Nameserver,Content Management System,Email Hosting Service,",Between €1-€100K,2024,https://swanlaab.com/,Active
Swap Your Travel,Spain,Sevilla,"Travel Arrangements, Transportation, digital platform",Between €100K-€500K,2022,https://www.swapyourtravel.com,Active
Swapfiets,Netherlands,Amsterdam,Cycling,No funding announced yet,2014,https://swapfiets.nl,N/A
Swaphouse,Netherlands,Amsterdam,"Home swapping, Workations, Travel, Free platform",No funding announced yet,2023,https://swaphouse.io/,Active
Swapi,UK,London,"Apps, Loyalty Programs, E-Commerce",Between €100K-€500K,2020,https://www.swapi.global/,N/A
Swapika,UK,London,"crypto exchange, swap service, exchange platform, convert crypto",No funding announced yet,2022,https://swapika.com,N/A
Swaplanet,Greece,Athens,"E-Commerce, Fashion",Between €100K-€500K,2021,https://www.swaplanet.com/,N/A
Swapoffi,Ireland,Dublin,SaaS,Between €1 million-€ 2.5 million,2021,https://swapoffi.com/,Active
Swapp,Poland,Warsaw,"GreenTech, Retail, Retail Technology, Sustainability",Between €100K-€500K,2020,https://swapp.zone,N/A
Swapper,France,Paris,"Business Consulting, Services, Travel, Sustainable",No funding announced yet,2023,https://swapper-app.com/,Active
Swappie,Finland,Helsinki,"Consumer goods, E-commerce, technology",N/A,2016,swappie.com/en/,N/A
Swappy Latam,Spain,Barcelona,"second hand, preloved, fashion, resell",Between €1-€100K,2021,www.swappy.mx,N/A
Swaptok,UK,London,"digital assets, Online Platform, blockchain, technology",No funding announced yet,2022,https://swaptok.io/index.php,N/A
Swarm Analytics,Austria,Tyrol,"AI, video analysis, algorithms, deep learning",N/A,2018,https://www.swarm-analytics.com/,N/A
Swarm64,Germany,Berlin,"Hardware Accelerator, PostgreSQL, Analytics, Swarm64, Berlin",N/A,2013,www.swarm64.com,N/A
Swascan,Italy,Cassina De' Pecchi,"Cyber Security, Penetration Testing, Cyber Incident Response",Between €500K-€ 1 million,2016,https://www.swascan.com/,N/A
Swastha,France,Paris,"Health, Wellness, Smart yoga mat, Fitness",No funding announced yet,2023,https://swastha.fr/,Idea Stage
Swati Cosmetics,Sweden,Stockholm,"Consumer Goods, E-Commerce, Fashion, Lifestyle",No funding announced yet,2019,https://www.swati.com,N/A
Swave Photonics,Belgium,Leuven,"Semiconductors, ARVR, Metaverse",No funding announced yet,2022,https://swave.io/,N/A
Swavy,UK,London,"AI, Marketing",Above €25 million,2023,https://www.swavy.app/,Active
Sway Technology,Sweden,Stockholm,sustainable platforms,No funding announced yet,2019,swayapp.io,N/A
Swayde,Bulgaria,Sofia,"Future of work, Music, Collaboration",Between €1-€100K,2020,swayde.app,N/A
Swayle,Norway,Oslo,"Sales, AI, Sales Automation,",Between €1-€100K,2022,https://swayle.ai,Active
Swayze,Poland,Warsaw,"Social media marketing, Content cretion, Customer promotion",Between €100K-€500K,2024,https://www.swayze.pl/english/home,Active
Swazm,Romania,Bucharest,"cloud, technology, blockchain",N/A,2018,https://swazm.com/#/,N/A
Sweatcoin,UK,London,"Apps, Finance, Internet, Personal Health",Between €5 million-€10 million,2015,http://sweatco.in/,N/A
Sweden,Sweden,Stockholm,"Animation, Digital Entertainment, Film, Media and Entertainment, Motion Capture",Between €10 million-€25 million,2014,http://goodbyekansas.com/,N/A
Swedish Temptations,Sweden,Karlshamn,"Food and Beverage, Organic Food",Between €1 million-€ 2.5 million,2019,https://swedishtemptations.com/,N/A
Sweeft Analytics,France,Paris,"Innovation, Sustainability, Analytics, Democratisation",Between €100K-€500K,2022,https://www.sweeft.ai,Active
Sweep,UK,London,"Expense Management, Open Banking, FinTech, Financial Reporting",Between €1 million-€ 2.5 million,2017,www.sweep.biz,N/A
Sweepatic,Belgium,Leuven,"Cybersecurity, Digital Risk, Fraud, Sweepatic, Leuven",N/A,2016,https://www.sweepatic.com,N/A
Sweepbright,Belgium,Antwerp Area,"real estate, properties, agencies, customer",N/A,2016,www.sweepbright.com,N/A
Sweephy,Estonia,Tallinn,"Data Cleaning, machine learning, deep learning, data science techniques",No funding announced yet,2022,https://www.sweephy.com/,N/A
Sweepr,Ireland,Dublin,"Smart Home, AI, NLP, Sweepr, Dublin",N/A,2018,https://sweepr.com,N/A
Sweet City,Hungary,Budapest,"marketplace, online cake delivery",Between €100K-€500K,2018,https://edesvaros.hu/,N/A
Sweet Pea Care,UK,Norwich,"Health, BigData",Between €10 million-€25 million,2022,https://sweetpea.care/,Active
Sweetch Energy,France,Rennes,"energy, renewable energy, green tech, sustainability",Between €5 million-€10 million,2015,sweetch.energy/,N/A
Sweetguest,Italy,Milano,"rentals, holiday, management",N/A,2016,https://sweetguest.com/,N/A
Sweeton,Cyprus,Nicosia,"Information Technology, Software",Between €1-€100K,2021,https://www.sweeton.com,N/A
Sweetspot,Belgium,Deerlijk,"product, software, management, consulting",No funding announced yet,2023,https://sweetspot-experts.com/,Active
Swegan,Sweden,Linkaping,"Computer, Electronics, Enterprise Software, Hardware, Manufacturing, Service Industry",Between €1-€100K,2014,http://swegan.se/,N/A
Swegreen,Sweden,Stockholm,"Sustainable, Circular, Farming",Between €5 million-€10 million,2019,http://swegreen.com,N/A
Swekki Technology Ab,Sweden,Stockholm,"Innovative Web Design, Digital Transformation Experts, Creative Online Solutions, Scandinavian Excellence in Design",No funding announced yet,2017,swekkitechnology.com,Active
Swen,Croatia,Zagreb,"TravelTech, B2B SaaS, B2B, Hospitality",No funding announced yet,2022,https://www.bornfight.com/work/swen/,N/A
Swetrix,Poland,Lublin,"analytics, b2b, saas",No funding announced yet,2021,https://swetrix.com,N/A
Swidch,UK,London,"Cyber Security, Information Technology, Security, Software",Between €2.5 million-5 million,2015,https://www.swidch.com/,N/A
Swiftcomply,Ireland,Dublin,"restaurants cities, hospitality",N/A,2018,www.swiftcomply.com,N/A
Swiftcourt,Sweden,Malmö,"B2B, E-Commerce, Internet, Legal, Peer to Peer, Retail, Shopping, Software",Between €1 million-€ 2.5 million,2016,https://swiftcourt.com/,N/A
Swiftlabs,Bulgaria,Sofia,"ai, ios, mobile, apps",No funding announced yet,2024,https://swiftlabs.lol,Active
Swiftle Ltd,UK,London,"no-code, low-code, development, startups",No funding announced yet,2021,swiftle.io,N/A
Swiftly,Sweden,Stockholm,"Recruitment, data, app",Between €100K-€500K,2020,https://hire.swiftly.one,N/A
Swiftpinz,UK,London,"Pinterest Marketing, Automated Pin Creation, Blog Promotion, Visual Content, Social Media Automation,",No funding announced yet,2024,https://www.swiftpinz.com/,N/A
Swiftr,Sweden,Stockholm,"Fitness, Health Care, Training, Wellness",Between €500K-€ 1 million,2016,https://swiftr.se/,N/A
Swiftsafe,UK,london,"cybersecurity,penetration testing,vapt,compliance",N/A,2016,https://swiftsafe.com,N/A
Swiftskill,UK,London,"Analytics, Gaming, Internet, Online Games, Video Games",Between €1-€100K,2020,https://swiftskill.gg/,N/A
Swiftxccess,UK,London,"Financial Services, FinTech, Information Technology",Between €500K-€ 1 million,2020,https://swiftxccess.com/,N/A
Swile Ex Lunchr,France,Paris,"FinTech, Payment, Restaurant Tickets, Swile, Lunchr, Paris",N/A,2017,https://www.swile.co,N/A
Swimbird,Sweden,Stockholm,"Asset Management, Banking, Finance, Financial Services, FinTech",No funding announced yet,2018,https://www.swimbird.se/,N/A
Swinz,Belgium,Evere,Insurtech,Above €25 million,2022,Swinz,Active
Swipcar,Spain,Barcelona,"renting, marketplace, cars",N/A,2018,https://swipcar.com/es,N/A
Swipe,Luxembourg,Luxembourg,"UX / UI, User Research, Digital Transformation, Mobile Design",N/A,2016,www.swipe.lu,N/A
Swipeguide,Netherlands,Amsterdam,"work instructions, SaaS, standard work",Between €1 million-€ 2.5 million,2015,https://www.swipeguide.com/,N/A
Swipejobb,Sweden,Malmo,"AI, Technology, Information, Internet",Between €100K-€500K,2022,https://swipejobb.se/,Active
Swipelux,Estonia,Tallinn,"Blockchain, Cryptocurrency, Finance, Financial Services, FinTech, Payments",No funding announced yet,2021,https://www.swipelux.com/,N/A
Swipii,UK,"Glasgow, Glasgow City","E-Commerce, Payments, Retail Technology, Small and Medium Businesses",Between €5 million-€10 million,2015,https://swipii.com/,N/A
Swipoo,Spain,Barcelona,"Vehicle Management, Software Development, Consumer Services",Between €100K-€500K,2021,https://swipoo.com,Active
Swipx,Denmark,Copenhagen,"software, digital, platform",N/A,2015,https://swipx.com/,N/A
Swirl Your Wines,Sweden,Stockholm,"Personalized Wine Discovery, AI-Powered Wine Recommendations, Digital Sommelier",Between €100K-€500K,2024,https://www.swirlyourwines.com,Active
Swiss Battery,Switzerland,Aarau,"Chemical Manufacturing, Batteries, Energy Storage",No funding announced yet,2023,https://swissbattery.com,N/A
Swiss Gate,Switzerland,Bachenbulach,"Cannabis, Cosmetics, E-Commerce, Health Care, Lifestyle, Organic Food, Wellness, Wholesale",Between €2.5 million-5 million,2019,https://swiss-gate.com/,N/A
Swiss Helden It Und Marketing Agentur,Switzerland,Bern,"digital marketing, seo services, UI/UX",No funding announced yet,2024,https://swisshelden.ch/,Active
Swiss Premium Doctors,Switzerland,Lucerne,"Health Care, Tourism",Between €1-€100K,2021,https://www.swisspremiumdoctors.com,N/A
Swiss Security Solutions Llc,Switzerland,Zürich,"Security, Investigations, Intelligence, Cyber",Between €100K-€500K,2018,www.swiss-security-solutions.com,N/A
Swiss Shakti Foundation,Switzerland,Zug,"Internet, Non Profit, Organization",No funding announced yet,2018,https://www.shakticoin.com/,N/A
Swiss Travel Market Bd Gmbh,Switzerland,Zürich,"online advertising, marketing, travel, tourism, hotels and transfers bookable",No funding announced yet,2022,https://www.swisstravelmarket.ch/,Active
Swiss Wood Solutions,Switzerland,Zurich,"Local Business, Small and Medium Businesses, Wood Processing",Between €1-€100K,2016,http://www.swisswoodsolutions.ch/home-en.html,N/A
Swissborg,Switzerland,"Lausanne, Vaud","Blockchain, Communities, Financial Services, FinTech, Wealth Management",Above €25 million,2017,http://swissborg.com,N/A
Swissdecode,Switzerland,Renens,"Biotechnology, Food and Beverage, Public Safety, Sustainability",Between €5 million-€10 million,2016,http://www.swissdecode.com/,N/A
Swisspod Technologies,Switzerland,Monthey,"technology, sustainability, high-speed, hyperloop",No funding announced yet,2019,https://swisspod.ch/,N/A
Switch Fm London,UK,London,"Switch FM, Switch FM London, Switch FM 100.40",No funding announced yet,2023,https://switchfm.co.uk,Active
Switch4Sure,Lithuania,Vilnius,"platform, insurance, policy",N/A,2018,https://s4s.lt/,N/A
Switchbird,UK,Kineton,"Advertising, Internet, Marketing",No funding announced yet,2020,https://www.switchbird.com/,N/A
Switchboard,Slovakia,Galanta,"Internet, Publishing",Between €2.5 million-5 million,2021,https://www.runswitchboard.com,N/A
Switchcraft,UK,London,"fintech,",Between €1 million-€ 2.5 million,2017,https://www.switchcraft.co.uk/,N/A
Switchd,UK,London,"Utilities, Smart Energy, Clean Tech",N/A,2017,www.switchd.co.uk,N/A
Switchee,UK,London,"Analytics, Consumer Electronics, Energy Efficiency, Property Management, SaaS, Software",Between €5 million-€10 million,2014,https://www.switchee.co/,N/A
Switchere,Estonia,Tallinn,"Bitcoin, Cryptocurrency, Ethereum, Financial Exchanges, FinTech",No funding announced yet,2019,switchere.com/,N/A
Switchez,UK,Wolverhampton,"Electricity, Energy, Consumption",N/A,2018,https://switchez.co.uk,N/A
Switcho,Italy,Milan,"Fintech, Analytics, E-Commerce",Between €500K-€ 1 million,2019,https://www.switcho.it/,N/A
Switchplan,UK,Barcelona,"energy Consumption, energy efficiency, savings, consumer information",No funding announced yet,2020,switch-plan.co.uk,N/A
Switchr,Sweden,Stockholm,"Energy, CleanTech, Solar, and Fintech",N/A,2020,https://switchr.global/en,N/A
Swobbee,Germany,Berlin,"batteries, mobile, rent, statons",N/A,2018,https://swobbee.de/,N/A
Swogo,Portugal,"Lisbon, Portugal","Retail, Automated Bundles, Innovative Retail",N/A,2012,www.swogo.com,N/A
Swollet,Ireland,Dublin,"Apps, E-Learning, Gaming",No funding announced yet,2020,https://www.swollet.com,N/A
Swood,Portugal,Aveiro,"platform, precision, timer savings, products, services",No funding announced yet,2020,https://www.useswood.com/,N/A
Swooee Gmbh,Germany,München,"Extreme Sports, price comparison engine, adventure, action.",Between €100K-€500K,2021,https://xtremecheck.com/,Idea Stage
Swoop,UK,London,"Banking, Financial Services, FinTech, Mobile Apps, Mobile Payments",No funding announced yet,2018,https://swoopfunding.com/,N/A
Swoopin,France,Paris,"Delivery, GreenTech, Information Technology, Last Mile Transportation, Logistics, Software, Sustainability",Between €5 million-€10 million,2019,http://swoopin.green,N/A
Sword Health,Portugal,Oporto,"digital, therapy, health",N/A,2014,www.swordhealth.com,N/A
Swotties,UK,Princes Risborough,"E-Learning, EdTech, Education, Primary Education",Between €1-€100K,2021,https://www.swotties.com/,N/A
Swsam Solutions,UK,Swindon,"Innovation, Agility, Responsibility",No funding announced yet,2021,www.swsam.co.uk,Active
Swyg,Ireland,Dublin,"video interviews, human resources, recruiting",Between €1 million-€ 2.5 million,2018,www.swyg.com,N/A
Swyvl,UK,London,"skill trading, social network, skill trading",No funding announced yet,2021,https://swyvl.com/,N/A
Sybel,France,Paris,"Audiobooks, podcasts, documentaries",Between €5 million-€10 million,2018,https://sybel.co/en/,N/A
Sycai Technologies,Spain,Barcelona,"MedTech, Medical Diagnostics, Health Care",No funding announced yet,2020,https://www.sycaitechnologies.com/,N/A
Syfly,Netherlands,Eindhoven,"data, sensor, cloud, accuracy",N/A,2019,https://www.syfly.nl/,N/A
Sygnum,Switzerland,Zurich,"Fintech, Financial services",No funding announced yet,2018,https://www.sygnum.com/,N/A
Sylbaa,Germany,Berlin,SaaS,Above €25 million,2022,https://www.sylbaa.com/,Active
Sylby,Germany,Berlin,"AI, Education",Between €1 million-€ 2.5 million,2022,https://sylby.com/,Active
Sylon,Ireland,Dublin,"Business Development, Information Technology, SaaS, Software",No funding announced yet,2019,https://www.sylon.io,N/A
Sylq,France,Paris,"Financial Services, Crptocurrency, MObile Payments, FinTech",No funding announced yet,2023,https://sylq.io/,N/A
Sylvera,UK,London,"Information Technology, Software",Between €5 million-€10 million,2020,https://www.sylvera.com/,N/A
Symanto Spain,Spain,Valencia,"Psycholinguistic Profiling, Competitor Intelligence, rand Monitoring, Big Data Analysis",No funding announced yet,2021,https://www.symanto.com/,Active
Symbe,UK,London,"B2B SaaS , Collaborative Business Case Platform, Value-selling",Between €1 million-€ 2.5 million,2023,https://symbe.co/,Active
Symbia Solutions,Spain,Córdoba,"Data science, foresty, agrotech, ecology, wildlife",N/A,2018,www.symbiasolutions.com,N/A
Symbiosis Finance,Estonia,Eden Island,"cross-chain Bridges, multi-chain Bridges, Decentralized Exchanges",Between €2.5 million-5 million,2021,https://symbiosis.finance/,N/A
Symbolian,Germany,Berlin,"human, technology, interaction",N/A,2015,www.symbolian.net,N/A
Symbolo,UK,"Ljubljana, Slovenia","smartphone, symbols, communication",N/A,2015,http://getsymbolo.com,N/A
Symfony,France,Clichy,"mountaineering adventure, climbing a rock wall, summit, methodology",No funding announced yet,2018,https://symfony.com/,N/A
Sympatient,Germany,Hamburg,"Health Care, mHealth, Psychology, Therapeutics, Virtual Reality",Between €2.5 million-5 million,2017,https://www.sympatient.com/,N/A
Symphera,Germany,Munich,"Health, SaaS",Between €1 million-€ 2.5 million,2021,https://symphera.io/,Active
Symphopay,Romania,Bucharest,"Information Technology, Marketing, Payments",Between €1 million-€ 2.5 million,2015,www.symphopay.com,N/A
Symphysis Medical,Ireland,Galway,"Medical, Medical Device",Between €1 million-€ 2.5 million,2018,https://www.symphysismedical.com/,N/A
Sympower,Netherlands,Amsterdam,"Electricity Monitoring, Smart Grids, Sustainable Energy, CleanTech",No funding announced yet,2015,www.sympower.net,N/A
Symson,Netherlands,Rotterdam,"Software Development, Pricing, Artificial Intelligence, Yield Management",Between €100K-€500K,2020,https://www.symson.com,N/A
Symvio,Luxembourg,Luxembourg,"Artificial Intelligence, Consulting, Professional Services, Risk Management",No funding announced yet,2019,https://www.symv.io,N/A
Syn Trac,Austria,Bad Goisern,Automotive,No funding announced yet,2019,https://www.syn-trac.at/,N/A
Synadia Software,Netherlands,Amersfoort,"Cloud Computing, Industrial Automation, Manufacturing",No funding announced yet,2016,https://synadia.nl/,N/A
Synaffix Bv,Netherlands,Oss,"Biotechnology, Therapeutics",No funding announced yet,2014,http://synaffix.com/,N/A
Synalogik,UK,Tewkesbury,"Data Integration, Data Visualization, Information Technology, Software",No funding announced yet,2021,https://synalogik.com/,N/A
Synamedia,UK,Staines-upon-thames,"Security, Software, Video",No funding announced yet,2021,https://www.synamedia.com/,N/A
Synaos,Germany,Hanover,"Cloud Computing, Logistics, Software",Between €5 million-€10 million,2018,synaos.com/,N/A
Synap,UK,Leeds,"Education, Science, Study",N/A,2017,https://synap.ac,N/A
