company name,category,based in,tags,total funding,founded,website,company status
Improbable,UK,London,"Games Development, Gamification, SpatialOS, Improbable, London",N/A,2012,www.improbable.io,N/A
Improve Public Mobility,Italy,TURIN,"mobility ,machine learning",No funding announced yet,2019,www.ipmsoft.it,N/A
Impus,Italy,Lombardi,"Big Data, Natural Language Processing, Personal Development, AI",Between €1-€100K,2020,impus.net/,N/A
Imrz Labs,UK,Manchester,"WEB3, NFTS, XR, Blockchain",No funding announced yet,2022,https://www.imrzlabs.com/,N/A
Imsa,France,Montauban,"Government ,Information Services, Information Technology",No funding announced yet,2019,https://informatique.msa.fr/lfy,N/A
Imverse,Switzerland,Merges,"3D Technology, Virtual Reality, Virtual World, Metaverse",Between €5 million-€10 million,2017,www.imverse.com,N/A
Imvitro,France,Paris,"Artificial Intelligence, Medical Device, Healthcare",No funding announced yet,2019,im-vitro.com/,N/A
Imvizar,Ireland,Dublin,"Digital Entertainment, Information Technology, Mobile Apps",Between €1-€100K,2021,https://www.imvizar.com,N/A
In France,France,Issy-les-moulineaux,"Consulting, Economic",Between €1-€100K,2021,http://www.in-france.io/,N/A
In Parallel,Finland,Helsinki,"AI,software,strategy execution,operating model",Between €2.5 million-5 million,2023,https://www.in-parallel.com,Active
In Time Link,Italy,Rome,"Mobile Payment, IoT, FinTech, Financial Services",Between €100K-€500K,2017,https://www.intimelink.com/,N/A
In2Ai,Spain,Madrid,"Artificial Intelligence, Machine Learning, Natural Language Processing",No funding announced yet,2020,in2ai.com,N/A
In4It,Belgium,Leuven,"outsource, devops, cloud",N/A,2015,https://www.in4it.io/,N/A
Inaccel,Greece,Athens,"hardware, accelerators, AWS F1",N/A,2018,www.inaccel.com,N/A
Inadmin Riskco,Netherlands,Utrecht,"Pension, Asset Management, Financial Services",No funding announced yet,2018,https://inadmin.com/,N/A
Inai,UK,London,"Fintech, Payments, Financial Services",No funding announced yet,2021,https://www.inai.io,N/A
Inalve,France,Nice,"Agriculture, AgTech",Between €10 million-€25 million,2016,http://www.inalve.com,N/A
Inappstory,Portugal,Faro,"saas, customer engagement, gamification",No funding announced yet,2019,https://inappstory.com/,Active
Inarix,France,Paris,"Artificial Intelligence, Information Technology Retail Technology, Software",Between €2.5 million-5 million,2018,https://www.inarix.com/,N/A
Inato,France,Paris,"eHealth, Pharmaceutical, BioTech, AI, Inato, Paris",N/A,2016,https://inato.com,N/A
Inbalance Grid,Lithuania,Vilnius,"electric vehicles, energy, charging, EV, technology, software, SaaS, mobility, infrastructure",Between €500K-€ 1 million,2020,https://www.inbalance.lt/,N/A
Inbentus,Spain,Murcia,"Medical Device, Healthcare, Medical Equipment",Between €100K-€500K,2020,https://inbentus.com/,N/A
Inbestme,Spain,Barcelona,"investment, exchange, funds",N/A,2015,https://www.inbestme.com/es,N/A
Inbet,Portugal,Vila Nova De Gaia,"Gambling, Gaming, Sports",No funding announced yet,2018,https://inbet.pt,N/A
Inbeverages Sa,Greece,Koropi,"functional, beverages, greek, herbs",Between €500K-€ 1 million,2018,www.inbeverages.gr,N/A
Inbiot Monitoring,Spain,Noain,"Industrial Engineering, Mechanical Engineering",Between €1-€100K,2018,https://inbiot.es/,N/A
Inboarding,Ireland,Dublin,"Artificial Intelligence, Employee Inboarding, Human Resource",No funding announced yet,2019,www.inboarding.co,N/A
Inboundli,Germany,Berlin,"MarTech, Social Media, Content Marketing",N/A,2014,https://inbound.li/,N/A
Inbrain Neuroelectronics,Spain,Barcelona,"MedTech, Health Care, Biotechnology",Between €10 million-€25 million,2019,https://www.inbrain-neuroelectronics.com/,N/A
Incapto Coffee,Spain,Barcelona,"Coffee, Food, Beverage",Between €500K-€ 1 million,2020,https://incapto.com/,N/A
Incard,UK,London,"FinTech, Financial services, Technology",No funding announced yet,2020,https://www.incard.co/,N/A
Incelligent,Greece,Kallithea,"Big Data, Knowledge Management, Telecommunications, Wireless",Between €1-€100K,2014,http://www.incelligent.net/,N/A
Incept Sustainability,Denmark,Copenhagen,"E-Learning, Information Technology, Service",No funding announced yet,2019,https://www.inceptsustainability.com/,N/A
Incepteo,UK,London,"Information Technology, Software, Internet of Things",No funding announced yet,2018,https://incepteo.com,N/A
Incepto Medical,France,Paris,"Artificial Intelligence, Health Care, Information Services",Between €5 million-€10 million,2018,incepto-medical.com/,N/A
Inch By Inch,Denmark,Copenhagen,"E-Learning, Information Technology, Sports",No funding announced yet,2020,https://inchbyinch.io/,N/A
Incharge,Netherlands,Haarlem,"AI, BigData, Fintech",Between €10 million-€25 million,2023,https://www.incharge.ai/,Active
Include,Croatia,Klis,"Electronics, Furniture, Internet of Things",N/A,2020,https://www.include.eu/,N/A
Includeos,Norway,Oslo,"Apps, Information Services, Information Technology, Software",Between €1 million-€ 2.5 million,2016,www.includeos.org/,N/A
Inclusive Sport Innovations,UK,Birmingham,"Inclusive Design, Social Innovation, Equity and Diversity, User-Centered Design",Between €100K-€500K,2025,https://www.inclusive-innovation.co.uk,Active
Incluview,Netherlands,Amsterdam,"Internet, Publishers,Web & Client Portals, B2C, SAAS",Between €100K-€500K,2022,https://www.incluview.com/,Active
Incognito,Ireland,Cork,"Cyber Security, Information Technology, Security, Software",No funding announced yet,2016,http://goincognito.co/,N/A
Income,Estonia,Tallinn,"Finance, Financial Services, Peer to Peer",Between €2.5 million-5 million,2020,https://getincome.com/,N/A
Income Marketplace,Estonia,Tallinn,"P2P, Marketplace, Transparency, Safety",Between €500K-€ 1 million,2020,Www.getincome.com,N/A
Inconnect,Netherlands,Amsterdam,"Insurance, InsurTech, Retail Technology, SaaS",No funding announced yet,2016,https://www.inconnect.io/,N/A
Incontalert Technologies,Germany,Bayreuth,"Artificial Intelligence, Health Care, Health Diagnostics, Machine Learning",Between €500K-€ 1 million,2019,https://incontalert.de/,N/A
Incooling,Netherlands,Eindhoven,BigData,Between €2.5 million-5 million,2019,https://www.incooling.com/,Active
Increasingly,UK,London,"Artificial Intelligence, Machine Learning, Retail Technology, SaaS",No funding announced yet,2016,https://www.increasingly.com/,N/A
Incremental Group,UK,Glasgow,"Software, analytics",Between €1 million-€ 2.5 million,2015,http://www.incrementalgroup.co.uk,N/A
Incubator,Denmark,Kiev,innovation finance platform,No funding announced yet,2021,we don't have a website yet,N/A
Incubator List,Sweden,Linköping,"Incubators, Internet, Venture Capital",No funding announced yet,2020,incubatorlist.com,N/A
Incube,UK,"London, England","Commercial Real Estate, Hardware, Internet of Things, Real Estate",No funding announced yet,2020,http://www.incube.space,N/A
Incust,UK,London,"customer management, customer communications, payments",N/A,2016,https://incust.com/,N/A
Incuto,UK,Ilkley,"Banking, Blockchain, FinTech, Payments",Between €2.5 million-5 million,2016,https://www.incuto.com,N/A
Indaco,Italy,Rome,"Beauty, Cosmetics, E-Commerce, Marketplace",No funding announced yet,2021,https://indacoapp.com,N/A
Indaru,Spain,Barcelona,"data science, marketing, audits",No funding announced yet,2020,https://www.indaru.com,Active
Independesk,Germany,Berlin,"Furniture, Internet, Mobile Apps, Rental",No funding announced yet,2020,https://independesk.com/,N/A
Index Groundworks,UK,Doncaster,"Landscaping, Outdoors, Design, Contractors",No funding announced yet,2023,http://indexgroundworks.co.uk,N/A
Index Of Sciences,UK,London,"Health Care, Publishing, Article",No funding announced yet,2018,https://www.indexofsciences.com/,N/A
Index One,UK,London,index provider data esg etf,Between €500K-€ 1 million,2021,https://indexone.io/,N/A
Indexcheckr,Spain,Vic,"SEO, marketing, agency",No funding announced yet,2021,https://indexcheckr.com,N/A
Indexstartup,UK,London,Startup Directories Launch,N/A,2019,https://indexstartup.com,N/A
Indiametrics,UK,London,"Marketing Agency, Content Writing Services",No funding announced yet,2017,https://indiametrics.com,N/A
Indian Business Pages,UK,Ahmedabad,with millions of verified online business records ibphub is India best online business directory register today,No funding announced yet,2004,https://www.ibphub.com,N/A
Indical Bioscience,Germany,Leipzig,"Biotechnology, Health Diagnostics, Life Science",No funding announced yet,2018,https://www.indical.com,N/A
Indico Capital Partners,Portugal,Lisbon,"Venture Capital, Equity Fund, Funding, Investment, SaaS, IoT",No funding announced yet,2017,https://www.indicocapital.com/,N/A
Indie,UK,London,"Content Creators, Software, Tourism",Between €1-€100K,2020,https://www.indietravel.co,N/A
Indie Campers,UK,Portugal,"Campervan rental, Travel, adventure, road trips",N/A,2013,https://indiecampers.com/,N/A
Indie Campers Italy,Italy,"Milan, Italy","campervan, travel, tourism, car rental",No funding announced yet,2017,https://indiecampers.it/,N/A
Indie Games Pass,Portugal,Lisbon,"Marketplace, Games, Game Pass, Indie Games",No funding announced yet,2021,https://www.indiegamespass.com/home,N/A
Indie Seguros,Portugal,Lisbon,Insurtech,Between €1 million-€ 2.5 million,2021,https://www.indie.pt/pt/,Active
Indiebi,Poland,Lodz,"Analytics, Information Technology, Software, Video Games",Between €2.5 million-5 million,2021,https://indiebi.com/,N/A
Indiedoers,UK,London,"video editing, freelancing, marketplace",No funding announced yet,2022,https://indiedoers.com,Active
Indiedrinksdirect,UK,London,SaaS,Between €1-€100K,2020,https://indiedrinks.direct/,Active
Indieframe,Denmark,Copenhagen,"Apps, Internet, News, Social Media, Social News",Between €5 million-€10 million,2016,https://www.indieframe.com,N/A
Indienov,France,Marseille,"AI, Health, SaaS",Above €25 million,2020,https://www.indienov.com/,Active
Indiepitcher,Czechia,Prague,"email, markdown, marketing",No funding announced yet,2023,https://indiepitcher.com,Active
Indievoice,Hungary,Budapest,"feedback platform, peer review, community, indie hackers",No funding announced yet,2024,https://indievoice.app,Active
Indigit,Portugal,Freamunde,"Web Design, Web Development, IOS Programming, IT Services",No funding announced yet,2018,https://www.indigit.pt/,N/A
Indigo Create,UK,London,"Content Creators, Graphic Design, Social Media",No funding announced yet,2020,https://indigocreate.co/,N/A
Indigo Diabetes,Belgium,Zwijnaarde,"Diabetes, Health Care, Medical, Medical Device",Above €25 million,2016,https://www.indigomed.com/,N/A
Indigo Labs,Slovenia,Ljubljana,"Cloud Computing, Information Technology, Software",Between €1-€100K,2021,https://www.indigo.si,N/A
Indivd Ai,Sweden,Sundsvall,"Artificial Intelligence, Enterprise Software Human Resources, Machine Learning, Retail Technology, SaaS, Software",Between €100K-€500K,2018,http://www.indivd.com/,N/A
Indivenire,Italy,Trento,"science, R&D, outsourcing, research",Between €1-€100K,2018,https://indiveni.re,N/A
Indiy,Greece,Athens,"Music Store, E-commerce, Technology",No funding announced yet,2020,www.indiy.com,N/A
Indomit,Spain,Barcelona,"Advertising, Content Creators, Marketing tool",No funding announced yet,2020,www.indomit.io/,N/A
Indoortech,Slovakia,Bratislava,"Customer Service, Home Decor, Interior Design, Manufacturing",No funding announced yet,2019,https://indoor-tech.com/,N/A
Indoorway,Poland,Warsaw,"iot, industry, data",N/A,2015,https://www.indoorway.com/,N/A
Indresmat,Spain,Hospitalet de Llobregat,"energy-efficiency, buildings, materials",No funding announced yet,2021,www.indresmat.com,N/A
Induction Healthcare Group,UK,London,"Health Care, Information Technology, Software",No funding announced yet,2019,https://inductionhealthcare.com/,N/A
Induo,France,Villeneuve-d’Ascq,"Fashion, Sustainability, Technology",Between €1 million-€ 2.5 million,2016,https://www.induo-textile.com/,Active
Indus Fusion,UK,Bristol,"Industrial Automation, Internet of Things, SaaS",Between €100K-€500K,2019,https://www.indusfusion.com/,N/A
Industrial Analytics Ia,Germany,Berlin,"Analytics, Internet of Things, Manufacturing, Mechanical Engineering",Between €1 million-€ 2.5 million,2017,https://www.industrial-analytics.io,N/A
Industrial Robotics Company,Lithuania,Kaunas,"industrual robots, no-code robot programming software",Between €1-€100K,2017,https://industrialrobotics.lt/,N/A
Indy,France,Lyon,"Accounting, Artificial Intelligence, FinTech, Freelance, Machine Learning, Software",Above €25 million,2016,https://www.indy.fr/,N/A
Ineedsocial,UK,"London, UK","social media marketing, seo agency",N/A,2014,https://www.ineedsocial.co.uk,N/A
Inereto,Romania,Bucharest,"API Development and Integration, Inereto CRM, IT Discovery & Business Analysis",Between €100K-€500K,2023,https://www.inereto.com,Active
Inergy Agtech,Romania,Bucharest,"waste, cities, IoT",No funding announced yet,2016,http://www.inergy-agtech.com/,N/A
Ines Analytics,Germany,Berlin,"Data analyst, Software development, B2B",Between €500K-€ 1 million,2021,https://www.ines-analytics.com/,Active
Inex One,Sweden,Stockholm,"Expert networks,Surveys,Private equity,Market research",Between €2.5 million-5 million,2018,https://inex.one/,Active
Infai,Norway,Oslo,"RegTech, Compliance, AI Governance",Between €1-€100K,2024,https://www.infai.tech/,Active
Infarm,Germany,Berlin,"FarmTech, FoodTech, Smart Farm",N/A,2012,www.infarm.de,N/A
Inferendo,Italy,Alessandria,"ai, recommendations, e-commerce",Between €1-€100K,2019,https://www.inferendo.com,N/A
Inferential Futures,UK,London,"AI, careers, graduates",No funding announced yet,2019,inferentialfutures.com,N/A
Infermedica,Poland,Wroclaw,"Artificial Intelligence,Health Care, Health Insurance",N/A,2012,infermedica.com,N/A
Infinigrid,Norway,Oslo,Real-time insights to seucurity of power supply,No funding announced yet,2023,https://infinigrid.ai/,Active
Infinileads,Spain,Marbella,"Digital Marketing, Digital Media, Media and Entertainment",No funding announced yet,2018,https://www.slotjava.es/,N/A
Infinit Bio,Germany,Berlin,"Biotechnology, Manufacturing, Medical",No funding announced yet,2021,https://www.infinit.bio/,N/A
Infinite Acres,Netherlands,Delft,"AgTech, Food and Beverage, Food Production",No funding announced yet,2019,http://www.infinite-acres.com/,N/A
Infinite Athletic,Spain,Barcelona,"Textile, Manufacturing, Infinite Athletic",Between €100K-€500K,2021,https://infiniteathletic.com/,N/A
Infinite Cab,Germany,Ravenéstr,"Taxi Management Software, Mobility, Transportation",N/A,2010,https://infinitecab.com/,N/A
Infinite Craft Guide,Portugal,Lisbon,"Crafting Guide, How to, Tips and Tricks",No funding announced yet,2024,https://www.infinitecraftguide.net,Active
Infinite Devices,Germany,Magdeburg,"Facility Management, Information Technology, Predictive Analytics, Smart Building",Between €1 million-€ 2.5 million,2020,https://www.infinitedevices.io/,N/A
Infinite Foundry,Portugal,Porto,"Automotive, 3D Technology, Cloud Computing",Between €500K-€ 1 million,2017,https://www.infinitefoundry.com/,N/A
Infinite Lambda,UK,London,"Big Data, Cloud Computing, Internet",No funding announced yet,2019,https://infinitelambda.com/,N/A
Infinite Mlm Software,Germany,Berlin,"MerTech, SEO, Social Network",N/A,2009,https://infinitemlmsoftware.com,N/A
Infinite Mobility,Norway,Oslo,"Automotive, Electric Vehicle, Mobility",Between €1-€100K,2020,https://www.infinite-m.com/,N/A
Infinite Orbits,France,Toulouse,"Satellite Maintenance, Orbit Correction, Satellite Deorbiting",Between €10 million-€25 million,2017,https://www.infiniteorbits.io/,Active
Infinite Roots,Germany,Hamburg,Marketing Automation,Between €5 million-€10 million,2018,https://www.infiniteroots.com/,Active
Infinited Fiber,Finland,Helsinki,"Sustainability, Environmental, Fashion, Materials",N/A,2016,https://infinitedfiber.com/,N/A
Infinited Fiber Company,Finland,Espoo,"Fashion, Textile, Sustainablity, Greentech, Biotechnology",Between €10 million-€25 million,2016,http://www.infinitedfiber.com/,N/A
Infinitia Research,Spain,Zaragoza,"materials, engineering, innovation, design",N/A,2014,https://www.infinitiaresearch.com/,N/A
Infinitspace,Netherlands,Amsterdam,"Information Services, Information Technology, Software",Between €1 million-€ 2.5 million,2020,https://www.infinitspace.com/,N/A
Infinitus Payments,Cyprus,Larnaca,"Banking, Finance, Financial Services, FinTech",No funding announced yet,2020,https://infinituspayments.com/,N/A
Infinity Binary,UK,Bristol,"website, web development, digital marketing, SEO",Between €1-€100K,2019,infinitybinary.com,Active
Infinity Electric Energy,Italy,Milan,"Renewable Energy, Semiconductor, Sustainable Mobility",No funding announced yet,2022,https://www.infinityelectricenergy.it/,N/A
Infinity Evergreen,UK,London,"Data Center Automation, Information Technology, Software",No funding announced yet,2020,https://infinityevergreen.com,N/A
Infinity Mobile,Belgium,Ghent,"e-commerce, AI, chatbots",No funding announced yet,2018,https://shopitag.com,N/A
Infinityn International,Hungary,Budapest,"Business Development, Consulting, Sales, Marketing",No funding announced yet,2016,www.infinityn.co/,N/A
Inflact,Latvia,Riga,"Advertising, DIgital MArketing, Software",No funding announced yet,2021,https://inflact.com/,Active
Inflazome,Ireland,Dublin,"medtech, cell, biotech",N/A,2016,http://inflazome.com,N/A
Inflead,Italy,Milan,"content, Instagram, social media",N/A,2018,https://www.inflead.com/,N/A
Inflight Vr,Spain,Barcelona,"TravelTech, VR, Entertainment",N/A,2014,https://www.inflight-vr.com,N/A
Inflo,UK,Houghton Le Spring,"Accounting, Financial Services",No funding announced yet,2016,https://inflosoftware.com/,N/A
Infloat,Netherlands,Utrecht,"blockchain, tokens, consultancy",N/A,2018,https://infloat.co,N/A
Inflow,UK,London,"Health Care, Hospital, Medical",Between €500K-€ 1 million,2020,https://www.getinflow.io/,N/A
Inflowmatix,UK,"Southampton, Southampton","Water, Water Purification",Between €5 million-€10 million,2015,https://inflowmatix.com/,N/A
Influads,Denmark,Copenhagen,"Advertising Network, AdTech, Crowdsourcing Platform",N/A,2010,http://www.influads.com,N/A
Influans,France,Paris,"Advertising, Big Data, Machine Learning, Marketing, SaaS",Between €5 million-€10 million,2014,https://www.influans.com/,N/A
Infludata,Austria,Vienna,"Advertising Services, Brand Marketing, Consulting, Digital Marketing",No funding announced yet,2020,https://www.infludata.com/,Active
Influence Vibes,Bulgaria,Sofia,"Digital Marketing, Advertising, ServicesMarketing Agency",No funding announced yet,2019,https://influencevibes.com/,N/A
Influencee,Italy,Rimini,"Advertising, Affiliate Marketing, Content Creators, Content Marketing",No funding announced yet,2019,https://www.influencee.it,N/A
Influencify,Poland,Rzeszów,"Advertising, Computer Vision, Information Technology, Marketing",Between €1-€100K,2020,https://influencify.co,N/A
Influent Media,Netherlands,Amsterdam,"Agency Engagement, Digital Sales Experience, Marketing, Advertisement",No funding announced yet,2018,http://www.influent-media.com/,N/A
Influentially,UK,London,"Content Marketing, Creative Agency, Social Media",No funding announced yet,2018,https://influentially.co.uk/,N/A
Influlook,France,Sophia Antipolis,"Influencers, social media, marketing, ecommerce",N/A,2018,www.influlook.com,N/A
Influry,Germany,Berlin,"social media, influencers",No funding announced yet,2017,https://influry.com/,N/A
Influteq,Spain,Barcelona,"influencer marketing, analytics, fintech, growth",No funding announced yet,2021,http://influteq.com/,Active
Infobip,UK,London,"Authentication Services,Content Management System,Authentication Services",Between €2.5 million-5 million,2006,https://www.infobip.com/,Active
Infocoin,Cyprus,Limassol,"All, Marketing, B2C",No funding announced yet,2023,https://www.infocoin.online/,Active
Infocus,UK,London,"Climate Change, Carbon Emission, Sustainability",Between €1-€100K,2020,infocus.world/,N/A
Infodal,UK,Birmingham,"IT training, software development, SAP, Oracle, data science, Python, analytics, cloud computing",No funding announced yet,2020,infodal.com,N/A
Infogrid,UK,London,"Artificial Intelligence, Facility Management, Information Technology, Internet of Things, Property Management, Smart Building, Software",Between €10 million-€25 million,2018,https://infogrid.io,N/A
Infomycity,Estonia,Estonia,"Digital, App, Software Development",Between €100K-€500K,2024,https://infomycity.eu/,Active
Infonet,Spain,Barcelona,"Finance, Legal Tech, Online Portals",No funding announced yet,2020,http://infonet.fr,N/A
Informa Tech,UK,London,"Information Services, Information Technology",No funding announced yet,2019,https://tech.informa.com/,N/A
Informed,Germany,Berlin,"Media and Entertainment, News, Online Forums",Between €2.5 million-5 million,2021,https://www.informed.so/,N/A
Informizely,Netherlands,Amsterdam,"Website surveys, email surveys, exit intent pop ups, full page surveys",N/A,2019,https://www.informizely.com/,N/A
Infosecura,Netherlands,Venray,"Information Services, Information Technology, business advice",No funding announced yet,2018,http://www.infosecura.com/,N/A
Infosum,UK,Basingstoke,"Advertising, Big Data, Information Technology, Privacy, Security",Above €25 million,2016,https://www.infosum.com/,N/A
Infotoggle,Finland,Espoo,"ecommerce, saas, cms tool",N/A,2019,https://infotoggle.com,N/A
Infracost,UK,London,"Cloud Computing, Information Services, Information Technology, Infrastructure, Web Design",Between €1 million-€ 2.5 million,2020,https://www.infracost.co.uk,N/A
Infrafon Gmbh,Germany,Freiburg,"edge Digitalization, Security, Workmanagement",Between €1 million-€ 2.5 million,2021,https://www.infrafon.com,Active
Infrafund,UK,Exeter,"Financing Methods, Blockchain, Sustainable Development, Impact Financing",Between €100K-€500K,2024,https://infrafund.net/,Active
Inframent,Netherlands,Noordwijk,"BigData, SaaS",Between €2.5 million-5 million,2022,https://www.inframent.com/,Active
Infrascreen,Switzerland,Neuchâtel,"AgTech, Farming, Nanotechnology",Between €1-€100K,2019,https://www.infrascreen.com/,N/A
Infraspeak,Portugal,Porto,"autonomous, information, fast",N/A,2015,home.infraspeak.com,N/A
Infrion,Sweden,Stockholm,"Health Care, Health Diagnostics",Between €1-€100K,2021,https://certify.health/en/professional,N/A
Inga,Germany,Frankfurt,"recruiting, lead generation, chatbots",N/A,2019,https://www.inga.one/,N/A
Ingain,Latvia,Riga,"FinTech, Payday Loans, Credit Software, Lending Solutions",Between €500K-€ 1 million,2011,https://www.ingain.com/,Active
Ingame,Spain,Valencia,"Computer, Gaming, Mobile Apps",No funding announced yet,2018,https://ingame.gg/,N/A
Ingenico Epayments,Netherlands,Hoofddorp,"E-Commerce, FinTech, Payments",No funding announced yet,2016,http://www.ingenico.com/epayments,N/A
Ingenium Education,Italy,Rome,"EdTech, Education, Higher Education, Primary Education",No funding announced yet,2019,https://www.ingeniumeducation.com/,N/A
Ingramer,Latvia,Riga,"Digital Marketing, Sales Automation, Software",Between €1-€100K,2021,https://ingramer.com/,N/A
Ingredio,Greece,Athens,"ingredients, cosmetics, app",N/A,2016,www.ingred.io,N/A
Ingresos Vip,Spain,Malaga,"finanzas, ahorro, beneficios, acciones, CFDs, ETFs, inmobiliaria, monetización",No funding announced yet,2025,https://ingresosvip.com,N/A
Ingrid,Sweden,"Stockholm, Stockholms Lan","E-Commerce, Logistics, SaaS, Shipping, Software, Supply Chain Management",Between €10 million-€25 million,2015,https://www.ingrid.com/,N/A
Ingrid Cloud,Sweden,Stockholm,"Cloud Computing, SaaS, Simulation, Software",Between €5 million-€10 million,2015,https://www.ingridcloud.com/,N/A
Inheart,France,Pessac,"Medical Device, Cardiology, Cloud Computing, Software,",Between €2.5 million-5 million,2017,www.inheart.fr/,N/A
Inheritx Solutions,Germany,Bad Säckingen,"Application Development Services, Mobile Services, Web Solutions",N/A,2011,http://www.inheritx.com,N/A
Inhubber,Germany,Berlin,"Blockchain, Contract Management, Contract Management System, IoT, BI, ERP, CLM, CRM, AI, Procurement Management, Contract Management Platform, B2B, Digital Signature, P2P Encryption, Vertragsmanagement, Digitale Signatur, Distributed Ledger Technology, Business Intelligence, SaaS, Software as a service, and 5G",N/A,2019,https://inhubber.com/,N/A
Inicare,Netherlands,Eindhoven,"medical, medtech, AI, wearables, cloud, vital signs, patient monitoring",N/A,2018,inicare.com,N/A
Inigo Ltd,UK,Bracknell,"Financial Services, Insurance, InsurTech, Business Risks",Above €25 million,2020,www.inigoinsurance.com/,N/A
Inion Software,Lithuania,Vilnius,"Battery, Energy, Energy Efficiency, Information Technology",Between €500K-€ 1 million,2019,https://inionsoftware.com/,N/A
Inismo,Austria,Klagenfurt,"Funding Platform, Investment Management, FinTech",N/A,2011,https://www.inismo.com/,N/A
Iniu,Portugal,Lisbon,"Food and Beverage, Health Care",Between €100K-€500K,2016,https://www.iniu.pt/,N/A
Injoymap,Spain,Palma de Mallorca,"tourist itineraries, tourist services, travel",No funding announced yet,2018,https://www.youtube.com/watch?v=fqF4srH7BkU,N/A
Ink On Sky,Spain,Barcelona,"Internet Publishing, Legal, Professionals",No funding announced yet,2021,https://inkonsky.com/tattoos,N/A
Inkitt,Germany,Berlin,"Analytics, Content, Publishing",Above €25 million,2014,http://www.inkitt.com,N/A
Inklarity,Spain,Madrid,"Apps, Art, Performing Arts, Professional Services",No funding announced yet,2021,https://www.inklarity.com/,N/A
Inkless,Netherlands,Delft,"Printing, Inkless, Print Tech",N/A,2015,www.inkless.ink,N/A
Inklesstocano,Netherlands,Delft,"printing, paper, technology",N/A,2015,www.inkless.ink,N/A
Inkoming,France,paris,"HR Tech, Recruiting, Application Tracking",N/A,2012,http://www.inkoming.com,N/A
