company name,category,based in,tags,total funding,founded,website,company status
Getid,Estonia,Estonia,"identityverification, KYC, AML",No funding announced yet,2019,https://getid.ee/,N/A
Getinside,France,Toulouse,"Technology, Information, Media",Between €1 million-€ 2.5 million,2022,https://www.getinside.fr/,N/A
Getinvoice,Spain,Girona,"accounting, productivity, ai",No funding announced yet,2024,https://www.get-invoice.com,Active
Getjenny,Finland,Helsinki,"Customer Service, Chatbots, AI, HR Tech",N/A,2016,www.getjenny.com,N/A
Getjobsdone,Netherlands,Amersfoort,"Internet Publishing, Mediation Platform, Fast Growing",Between €100K-€500K,2020,https://www.getjobsdone.nl/,N/A
Getkiki,UK,Glasgow,"Sustainable Fashion, Women Activewear, Clothing Marketplace",No funding announced yet,2020,https://www.getkiki.com,N/A
Getlife,Spain,Madrid,Insurance,Between €500K-€ 1 million,2021,http://getlife.com,N/A
Getmassage,Spain,Barcelona,"booking, massages, therapy",N/A,2015,https://www.getmassageapp.com/,N/A
Getmefit,UK,London,"Fitness, Health Care, Wellness",No funding announced yet,2020,https://www.getmefit.co/,N/A
Getmehired,Romania,Bucharest,"Mock interviews, HR managers, HR",No funding announced yet,2021,www.getmehired.ro,N/A
Getmetrics,Germany,Leipzig,"Stripe, Notifications, Metrics",N/A,2014,https://getmetrics.io,N/A
Getmomo,Germany,Berlin,"CMS, Financial Services, Property Management, Real Estate, Software",No funding announced yet,2021,https://www.getmomo.de/,N/A
Getmycar,Italy,Milan,"Car Rental, Car sharing, Online platform",No funding announced yet,2017,https://getmycar.com/it,N/A
Getmyinvoices,Germany,Lübeck,"SaaS, Software, Documents",No funding announced yet,2004,https://www.getmyinvoices.com/,N/A
Getmylook,Bulgaria,Sofia,"Retail Apparel, Fashion, AI Stylist",Between €100K-€500K,2024,https://getmylook.ai,Active
Getmysquad,France,Notre Dame Du Pre,"App, Recruitment ecosystem, Skill & Cultural Matching, small business interface",Between €1-€100K,2023,www.getmysquad.com,Active
Geton Global,Slovenia,Ljubljana,"Blockchain, Cyber Security, Technology, Cryptocurrency",No funding announced yet,2018,geton.global/,N/A
Getonnet,Norway,Ulefoss,"Advertising, Digital Marketing, Web Design, Web Development",No funding announced yet,2016,getonnet.no,N/A
Getpaid,Germany,Düsseldorf,"Financial Services, Social Sharing, Image and Video Services,",No funding announced yet,2022,https://www.getpaid.io/,Active
Getqrfree,UK,London,Free QR Code Generator,No funding announced yet,2025,https://www.getqrfree.com/,Active
Getquin,Germany,Berlin,"Financial Services, FinTech, Impact Investing, Wealth Management",Between €1 million-€ 2.5 million,2020,https://getquin.onelink.me/jocx/linkedin,N/A
Getquiz,Poland,Rzeszów,"quiz maker, quizzes",No funding announced yet,2025,https://getquiz.io,Active
Getsafe,Germany,Heidelberg,"InsurTech, Digital Insurance, AI",N/A,2015,www.hellogetsafe.com,N/A
Getsalesbot,UK,London,"chatbots, chatbot agency, chatbot marketing agency,",No funding announced yet,2022,getsalesbot.com,Active
Getscreenme,Cyprus,Limassol,"Technology, Information, Internet, Software",Between €100K-€500K,2019,https://Getscreen.me,Active
Getsnap,Lithuania,Vilnius,"Visual search, e-commerce",No funding announced yet,2020,getsnap.eu,N/A
Getsocial,Portugal,Lisbon,"B2B software, online stores, social media",No funding announced yet,2012,http://www.getsocial.io,N/A
Getstartedhq,UK,"Bristol, UK","resources, news, offers",N/A,2015,https://getstartedhq.com/,N/A
Getsteps,Germany,Berlin,"Health Care, Shoes, Wellness",Between €1 million-€ 2.5 million,2019,https://get-steps.com/,N/A
Getsurance,Germany,Berlin,"Information Technology, Insurance, InsurTech, Internet",Between €2.5 million-5 million,2016,https://getsurance.de,N/A
Gett,Estonia,Tallinn,"translation, localization, b2b, subtitling",Between €100K-€500K,2017,https://gettranslation.io,Active
Gettranslation,Estonia,Tallinn,"translation, localization, b2b, subtitling",Between €100K-€500K,2017,https://gettranslation.io,Active
Getuser Ai,Spain,Barcelona,"Email Lookup, Reverse Email Lookup, Sales Intelligence",No funding announced yet,2024,https://www.getuser.ai,Active
Getvisibility,Ireland,Cork,"Artificial Intelligence, Cyber Security, Security, Software",Between €1 million-€ 2.5 million,2017,www.getvisibility.com/,N/A
Getwhin,Spain,Alaior,"hotel management, hotels",N/A,2019,https://getwhin.com/en/,N/A
Getyourguide,Germany,Berlin,"TravelTech, Shared Experiences, Recommendations Platform",N/A,2009,www.getyourguide.com,N/A
Getzero,UK,London,"Education, SaaS, Sustainability",Between €5 million-€10 million,2021,GetZero,Active
Geyser Batteries,Finland,Helsinki,"Battery, Energy Storage, Manufacturing",Between €1 million-€ 2.5 million,2018,https://www.geyserbatteries.com/,N/A
Gfaive,UK,London,"Artificial Intelligence, Machine Learning, Predictive Analytics",No funding announced yet,2020,www.gfaive.com/,N/A
Gfn Advisors,Greece,Athens,"Consulting Agency, Market Intelligence, Competitive Intelligence",No funding announced yet,2019,http://www.gfnadvisors.gr/,N/A
Gfoundry,Portugal,Matosinhos,"Human Resources, Information Technology, SaaS, Software",No funding announced yet,2014,http://gfoundry.com/,N/A
Gg Care,UK,London,"Professional Services, Technical Services, B2C",Between €100K-€500K,2020,https://www.gg.care/,Active
Ggpredict,Poland,Warsaw,"Artificial Intelligence, Big Data, eSports, Gaming",Between €1 million-€ 2.5 million,2019,https://ggpredict.io/,N/A
Gh Research,Ireland,Dublin,"Biopharma, Biotechnology, Pharmaceutical",Above €25 million,2018,https://www.ghres.com/,N/A
Ghetool,Belgium,Waregem,"Geothermal, borefield, BTES, sizing",No funding announced yet,2022,https://ghetool.eu,N/A
Ghost Feel It,Germany,Berlin,"Sensor, Prothesis, Learning",N/A,2017,https://www.ghost-feel.it,N/A
Ghost Ship Games,Denmark,Copenhagen,"videogame, gaming, game developers",No funding announced yet,2016,www.ghostship.dk,N/A
Ghostwriter Texte,Germany,"Bayern, Lengdorf","Essay, Proofreading, Consulting, Writing, Service, Education",No funding announced yet,2009,https://ghostwriter-texte.de,N/A
Ghostwriting Preise,Germany,"Berlin, Berlin","Essay, Study, University Students, Thesis, Students, Homework",No funding announced yet,2023,https://ghostwritingpreise.de,N/A
Giance,Germany,Berlin,"Artificial Intelligence, Big Data, Enterprise Software, Information Technology",No funding announced yet,2018,http://www.giance.ai,N/A
Giant Swarm,Germany,Cologne,"Microservice Infrastructure, Web Hosting, Cloud Application Platform",N/A,2014,https://giantswarm.io/,N/A
Giantcampaign,Belgium,Roeselare,"email,marketing,platform",No funding announced yet,2023,https://giantcampaign.com,Active
Gibobs Allbanks,Spain,Majadahonda,"Finance, Financial Services, FinTech",No funding announced yet,2020,https://www.gibobs.com/,N/A
Gibses O,Estonia,Tallin,"Technology Synergy, Vendor-Independent, Scalable Ecosystems, ROI-Driven Innovation",Between €100K-€500K,2025,www.gibses.com,Active
Gideon Brothers,Croatia,Zagreb,"AI, logistics, manufacturing, industrial",N/A,2017,https://www.gideonbros.ai/,N/A
Gidsy,Germany,Berlin,"TravelTech, Local Experience, Recommendation Platform",N/A,2011,http://www.gidsy.com,N/A
Giftbull,UK,London,"e-gift card, voucher, shopping",No funding announced yet,2018,www.giftbull.com,N/A
Giftgenie,UK,Lancing,"Gift Ideas, Gifting, Gift Reccomendations",No funding announced yet,2024,https://www.thegiftgenie.co,Active
Gifts For Change,France,Paris,"Consumer goods, gifts, environment",N/A,2014,www.giftsforchange.fr/,N/A
Gig,UK,London,"Employment, Hospitality, Retail",Between €1 million-€ 2.5 million,2015,http://gigtogig.co.uk/,N/A
Gigable,Ireland,Dublin,"productivity, work, and independence",N/A,2018,https://gigable.com,N/A
Gigafile,Norway,Moss,"File Sharing, Privacy, Unlimited",N/A,2017,http://gigafile.net,N/A
Gigagi,France,Reims,e-Commerce,Above €25 million,2022,https://www.gigagi.fr/fr/,Active
Gigantic Digital Growth,Portugal,Lisbon,"Advertising, Digital Marketing, Digital Growth",No funding announced yet,2020,https://www.gigantic.pt,N/A
Gigantic Duck,Sweden,Boras,"Online Games, Video Games, Computer Games",Between €5 million-€10 million,2019,https://giganticduck.com/,N/A
Gigapay,Sweden,Stockholm,"Financial Services, FinTech, Marketplace",No funding announced yet,2018,https://gigapay.co,N/A
Gigglemusic,Czechia,Prague,"Apps, Information Technology, Music, Social Network",No funding announced yet,2019,https://gigglemusic.net/,N/A
Gigimot,Estonia,Tallinn,"healthcare, clinic software, practice management, practice management software, workflow automation, optimisation",Between €1-€100K,2020,https://gigimot.com,Active
Giglike,Poland,Warsaw,"Human Resources, PaaS, Predictive Analytics",Between €100K-€500K,2020,https://www.giglike.com/en/home/,N/A
Gigrove,UK,London,"e-commerce, freelancers",No funding announced yet,2015,https://gigrove.com,N/A
Gigsguide,Sweden,Sweden,"Travel, Events, Database",N/A,2017,https://gigs.guide,N/A
Gigway,Sweden,Stockholm,"Consulting, Graphic Design, Human Resources, Social Media Marketing",Between €2.5 million-5 million,2018,https://gigway.se,N/A
Gigy,Estonia,Tallinn,"Gig Economy, Gig Jobs Marketplace, Income Optimization for Gigsters",Between €1-€100K,2019,www.gigy.app,N/A
Gigzy,Portugal,Lisbon,"Events Services, Artists, Live Entertainment, Innovation",Between €100K-€500K,2023,https://gigzy.pt/,Active
Gilbert,France,"Paris, Paris","Storage, Moving, Logistics, Service Industry, Transportation, Warehousing",No funding announced yet,2019,https://www.gilbert.paris,N/A
Gilinda,Hungary,Budapest,"project management, CRM, contract lifecycle management, business management software",No funding announced yet,2022,https://gilinda.hu,N/A
Gilion,Sweden,Stockholm,"Financial Services, Computer Company, Growth Analytics",Between €10 million-€25 million,2021,https://www.gilion.com/,Active
Gilytics Ag,Switzerland,Zurich,"SaaS, energy, design, planning, infrastructure, optimization",Between €1 million-€ 2.5 million,2017,www.gilytics.com,N/A
Gimber,Belgium,Tubize,"ginger, drink, beverage, alcohol free",No funding announced yet,2018,www.gimber.com,N/A
Gimly,Netherlands,Amsterdam,"Blockchain, Data Security, Software, Products",Between €100K-€500K,2021,https://gimly.io,Active
Gimmy,Belgium,Leuven,Health,Between €5 million-€10 million,2022,https://gimmyproducts.com/,Active
Ginalabs,Poland,Warsaw,"Trading, Training, Software Development, Asset Growth",No funding announced yet,2023,ginalabs.com,Idea Stage
Ginger Marketing,UK,Linlithgow,"content marketing, seo, digital marketing",No funding announced yet,2016,https://www.gingermarketinghq.com/,N/A
Gini,Germany,Munich,"Fintech, banking, accounting, Gini, Munich",N/A,2011,www.gini.net,N/A
Ginkgo Analytics,Germany,Hamburg,"Analytics, Artificial Intelligence, Data Visualization, Information Technology",No funding announced yet,2017,https://www.ginkgo-analytics.com,N/A
Ginmon,Germany,Frankfurt,"FinTech, Wealth management, Intelligent Investing, AI",N/A,2015,www.ginmon.de,N/A
Gino Legaltech,France,Paris,"Contact Management, Legal, Legal Tech, Software",No funding announced yet,2017,www.ginolegaltech.com/,N/A
Giotto,France,Paris,"E-Commerce, Circular Economy, Rentals",No funding announced yet,2020,begiotto.com/,N/A
Giraez,Spain,Madrid,"E-commerce, Safety, Transactional Conversation",Between €100K-€500K,2021,https://giraez.com/,N/A
Girafe Mentoring,Spain,Logroño,"Data Science, Mentorship, Job landing",Between €100K-€500K,2022,https://girafe.io/,N/A
Giraffa Education,Spain,Barcelona,"Education, Entrepreneurs, Community",No funding announced yet,2021,https://www.giraffaeducation.com/,Active
Giraffe360,UK,London,"PropTech, Real Estate, Photography, Floor Plan",N/A,2016,www.giraffe360.com,N/A
Girasole Energies,France,Boulogne-billancourt,"Renewable Energy, Power Generation, Electrical Distribution",Above €25 million,2023,https://girasole-energies.com/,N/A
Giroxx,Germany,Frankfurt,"Fintech, Money Transfer, International, Transfer, Frankfurt",N/A,2015,http://www.giroxx.de/,N/A
Giskard,France,"Paris, Paris","Machine Learning, Artificial Intelligence, Testing",No funding announced yet,2021,https://www.giskard.ai,N/A
Git Digest,Romania,Romania,"SoftwareDevelopment,AIAssistant,CodeChangeSummaries",Between €1-€100K,2024,https://gitdigest.ai,Active
Git Editor,Germany,Berlin,"Developer Tools, Information Technology, Open Source, Software",No funding announced yet,2020,https://giteditor.app/,Active
Gitbook,France,Lyon,"publishing, writing, Internet",Between €100K-€500K,2014,https://www.gitbook.com/,N/A
Gitguardian,France,Paris,"Security, Cloud, Cybersecurity",N/A,2017,http://www.gitguardian.com/,N/A
Gitmate,Germany,Hamburg,"Artificial Intelligence, Machine Learning, Software, Ticketing",Between €1-€100K,2017,https://gitmate.io/,N/A
Gitscrum,Portugal,Lisbon,"Project Management, Information Technology & Services",No funding announced yet,2017,https://gitscrum.com/,N/A
Gitti,Germany,Berlin,"beauty, consumer goods, conscious beauty",Between €2.5 million-5 million,2020,https://www.gitticonsciousbeauty.de/,N/A
Givebio,UK,Enfield,"Mobile, App, Charitable",N/A,2017,https://givebio.com/,N/A
Givenget,Croatia,Split,"exchange, platform, community, circulareconomy",No funding announced yet,2021,ugivenget.com,Active
Givetastic,Germany,Hanover,"Apps, Charity, Information Technology, Internet",No funding announced yet,2019,http://www.givetastic.org,N/A
Givt,Netherlands,Lelystad,"Marketing, Mobile Apps, Web Apps",Between €1 million-€ 2.5 million,2016,https://www.givtapp.net/,N/A
Gizelis Robotics,Greece,Evvoia,"Industrial Automation, Industrial Engineering, Manufacturing, Robotics",No funding announced yet,2018,https://grobotics.eu/,N/A
Glacier,Austria,Vienna,"Environmental Consulting, Environmental Engineering, Environmental Services",No funding announced yet,2020,https://glacier.eco/,N/A
Gladcloud,Ireland,Dún Laoghaire,"Mobile Advertising, SaaS, Social Media Advertising, Software",Between €100K-€500K,2017,http://www.gladcloud.mobi/,N/A
Gladio Capital,Spain,Madrid,"Finance, Startup, Invest, CFO",Between €1-€100K,2019,www.gladiocapital.es,Active
Glaize,UK,London,"Beauty, Computer Vision, E-Commerce",Between €100K-€500K,2020,https://www.glaize.co/,N/A
Glambook,Germany,Berlin,"salon software, salon booking",No funding announced yet,2021,https://glambook.de/,N/A
Glambou,Germany,Berlin,"E-Commerce, Jewelry",No funding announced yet,2018,https://www.glambou.com,N/A
Glanaer,Ireland,Dublin,"SaaS, Software",No funding announced yet,2020,www.glanaer.com,N/A
Glanceable,France,Saint-mande,"Software Development, SAAS, Marketing",Between €100K-€500K,2020,https://www.glanceable.io/,N/A
Glanect,UK,London,BigData,Between €100K-€500K,2022,https://glanect.com/,Active
Glantus,Ireland,Dublin,"Accounting, Analytics, Business Intelligence, Enterprise Software, Software",No funding announced yet,2014,https://www.glantus.com/,N/A
Glapp,Spain,Barcelona,"AI, health, weight loss, b2c",No funding announced yet,2025,https://glapp.io,Active
Glas Data,UK,Penryn,"Data Center, Data Visualization, Real-time data management",Between €100K-€500K,2018,https://glas-data.co.uk/,N/A
Glasport Bio,Ireland,Galway,Biotechnology,No funding announced yet,2018,https://glasportbio.com/,N/A
Glassdollar,Germany,Berlin,"Data Mining, Internet, Search Engine",Between €1-€100K,2019,http://glassdollar.com,N/A
Glasses Hut,UK,Liverpool,"Glasses, Online, Prescription Eyeglasses",No funding announced yet,2019,https://www.glasseshut.co.uk/,N/A
Glassette,UK,Weston-super-mare,"Home Decor, Information Services, Retail",Between €1 million-€ 2.5 million,2021,https://glassette.com,N/A
Glassfy,Italy,Turin,"Android, iOS, Mobile Payments, Software",No funding announced yet,2021,https://glassfy.io,N/A
Glassig,Switzerland,Geneva,"Computer, Small and Medium Businesses, Software",Between €1 million-€ 2.5 million,2016,http://www.glassig.com/,N/A
Glasskoo,Romania,Bucharest,"e-commerce, Saas, fashion e-commerce, AR",Between €1-€100K,2020,https://glasskoo.com/,N/A
Glasskube,Austria,Vienna,"Technology, Information, Internet, Cybersecurity",No funding announced yet,2023,https://glasskube.eu/,N/A
Glassnode,Switzerland,Zug,"Artificial Intelligence, Bitcoin, Blockchain, Cryptocurrency, Data Visualization, FinTech, Information Technology, Internet, Machine Learning, Software",No funding announced yet,2017,https://glassnode.com/,N/A
Glbnxt,Netherlands,Amsterdam,"ai, enterprise search, platform",No funding announced yet,2024,www.glbnxt.com,Active
Gleamer,France,Paris,"Artificial Intelligence, Software",No funding announced yet,2017,http://www.gleamer.ai/,N/A
Gleap,Austria,Dornbirn,"bug reporting, software development, app development, developer tools,",No funding announced yet,2020,https://www.gleap.io,Active
Glenntex,Sweden,Gothenburg,"Recycling, Industry Solutions, Sustainability",No funding announced yet,2021,https://www.glenntex.com/,N/A
Glex,Spain,Barcelona,Online Migratory processes,Between €1-€100K,2021,http://glex.es/,N/A
Gliapharm,Switzerland,Geneve,Biotechnology,Between €1 million-€ 2.5 million,2016,https://www.gliapharm.com,N/A
Glidescale,Portugal,Lisbon,"Universal Affiliate Marketing, Real-Time Performance Monitoring, Cross-Platform Promotion",Between €100K-€500K,2023,https://www.glidescale.me,Active
Glima,France,Paris,AI Image & Video Generator,No funding announced yet,2025,https://glima.ai,Active
Glimpse Protocol,UK,London,"Consumer Privacy, Advertisement, AdTech, Data Protection, GDPR",Between €1 million-€ 2.5 million,2019,www.glimpseprotocol.io,Closed
Glink,Austria,Traismauer,BigData,Above €25 million,2020,https://glink.solutions/,Active
Glint Solar,Norway,Oslo,"Artificial Intelligence, Machine Learning, Renewable Energy, Software",Between €1-€100K,2020,https://www.glintsolar.co/,N/A
Glissandoo,Spain,Valencia,"IT Services, IT Consulting, SaaS, Software",Between €1-€100K,2021,https://glissandoo.com,Active
Glitch Ads,Ireland,Dublin,"Advertising, AI, Technology",Between €1 million-€ 2.5 million,2023,https://www.glitchads.ai/,Active
Glitnor,Malta,Valletta,"Casino, Gambling, Digital Entertainment, Software",No funding announced yet,2018,https://glitnor.com,N/A
Glitter Finance,Estonia,Tallinn,"Blockchain, Cryptocurrency",Between €2.5 million-5 million,2021,https://glitter.finance/,N/A
Glitterbug,UK,Dublin,"consumers, lawyers, marketplace",N/A,2016,https://www.glitterbug.ie,N/A
Glivee,Italy,Milan,"Consumer Goods, E-Commerce, Retail Technology",Between €1-€100K,2021,https://glivee.com/,N/A
Globacap Limited,UK,London,"Digitised Cap Table Management, Fundraising Management, Private Placement, Custody",N/A,2017,Globacap.com,N/A
Global Admissions,UK,London,"Education , Administration Programs,",No funding announced yet,2022,https://www.globaladmissions.com,N/A
Global Biodesign,Belgium,Brussels,"biocontrol, green, sustainable",No funding announced yet,2017,https://globalbiodesign.com,N/A
Global Database,UK,London,"B2B, Lead generation, sales leads, credit reports",No funding announced yet,2015,www.globaldatabase.com,N/A
Global Equestrian Group,Denmark,Vodskov,Sports,No funding announced yet,2021,https://globalequestriangroup.com/,N/A
Global Expansion,Portugal,Lisbon,international business expansion,No funding announced yet,2020,https://www.globalexpansion.com/,N/A
Global Fintech Solutions,Luxembourg,Luxembourg,"Data Integration, FinTech, Information Technology, Software, Web Development",Between €10 million-€25 million,2017,https://gfs-technologies.com/,N/A
Global Inspector Ai App,Switzerland,Zurich City,"CyberSecurity, BlockchainTechnology, FraudPrevention, AIInnovation",No funding announced yet,2023,https://www.globalinspector.ai/,Idea Stage
Global Jobcoin,Switzerland,Wollerau,"Blockchain, Human Resources, Payments",Between €5 million-€10 million,2014,https://www.globaljobcoin.com/,N/A
Global Legaltech Hub,Spain,Barcelona,"Legal, Legal Tech",No funding announced yet,2020,www.hublegaltech.com/,N/A
Global Rockstar,Austria,Vienna,"Music Tech, Marketplace, Fundraising, Global Rockstar, Vienna",No funding announced yet,2014,www.globalrockstar.com,N/A
Global Smart Rescue,France,Toulouse,"Information Technology, Satellite communication, Intranet communicatio , Home alarms",Between €1-€100K,2019,https://globalsmartrescue.com/,N/A
Global Vehicle Payment System,Estonia,Tallinn,"payment system, GVPS",No funding announced yet,2017,https://www.youtube.com/watch?v=lzhlgFHExg8&feature=youtu.be,N/A
Global Wealth Group,UK,London,"Financial Services, FinTech, Payments",No funding announced yet,2018,http://www.globalwealthgroup.com,N/A
Globalblock,UK,London,"Blockchain, Cryptocurrency, Financial Services",No funding announced yet,2018,http://www.globalblockdigital.com/,N/A
Globalgeniuses,Spain,Barcelona,"Retail, Art Supplies, Digital Tools",Between €100K-€500K,2018,https://www.globalgeniuses.art/,N/A
Globalizationpedia,Ireland,Donegal,"Consulting, Global, Insights, Professional Services, Market",No funding announced yet,2017,https://globalizationpedia.com,N/A
Globalowls,Netherlands,Amsterdam,"Marketing, Design, Donation, NGOs",N/A,2017,https://globalowls.com,N/A
Globalrisk,Austria,Vienna,"Artificial Intelligence, Business Intelligence, Cyber Security, Information Technology, Risk Management",No funding announced yet,2021,https://www.globalrisk.ai/,N/A
Globalsphere Ltd,UK,London,Shaping Tomorrow’s Identities Today,No funding announced yet,2023,Www.GlobalSphere.io,Active
Globe Green Energy,Poland,Stara Iwiczna,"Biomass Energy, Clean Energy, Energy, Energy Efficiency",Between €1 million-€ 2.5 million,2020,http://www.globegreenenergy.pl/,N/A
Globe Tracker,Denmark,Copenhagen,"Software, Software Engineering, Supply Chain Management",Between €1-€100K,2007,www.globetracker.com,N/A
Globeflow,UK,Durham,"consulting, information technology, sales tools",No funding announced yet,2019,https://www.globeflow.com/,N/A
Globejotr,UK,London,"Social Network, Location Centric, Worldmap",N/A,2014,http://globejotr.com,N/A
Globemonitor,Portugal,Braga,"Market research, Business Plan, Market Insights",No funding announced yet,2018,https://globemonitor.co/,Active
Globeria Consulting Gmbh,Germany,Magdeburg,"Software development, IT Outsourcing, Web Development",No funding announced yet,2022,https://www.globeriaconsulting.de/,Active
Globetrip,Estonia,Tallin7,"travel agency, blockchain",N/A,2018,www.globetrip.biz,N/A
Globetrotter Vr,Spain,Barcelona,"holidays, travel, travel tech, VR, AR, technologies, travel planning, experience, guides",N/A,2019,https://globetrotter-vr.com,N/A
Globodain,Spain,Seville,"technology, Erasmus+, software, Globodain",No funding announced yet,2021,https://globodain.com,Active
Glofox,Ireland,Dublin,"Sport Tech, Fitness, Gym Management, Scheduling, Glofox, Dublin",N/A,2014,www.glofox.com,N/A
Glokal Ai,Germany,Berlin,"Cross-cultural AI, Language Technology, Digital Transformation",Between €100K-€500K,2024,https://www.glokalai.com/,Active
Glopal,France,Paris,"Marketing, IT Services, IT Consulting",Between €2.5 million-5 million,2020,https://merchants.glopal.com/en-us,N/A
Gloppa,UK,London,"Startups, Productivity, Acceleration",No funding announced yet,2022,gloppa.co,N/A
Gloria,Spain,Barcelona,"Health Care, Information Technology, Life Science,Software",Between €1-€100K,2021,https://www.gloria.digital/,N/A
Glorify,UK,London,"SaaS, e-commerce, software",N/A,2019,http://glorifyapp.com/,N/A
Glorify App,UK,London,"SaaS, Marketplace, Platform",No funding announced yet,2019,www.glorify.com,N/A
Glossiq,Slovenia,Nova Gorica,"IT Services, IT Consulting, Beauty, Software",No funding announced yet,2020,https://www.glossiq.io/,Active
Glossybox,Germany,Berlin,"Cosmetics, Makeup, online marketing",Above €25 million,2011,https://www.glossybox.com/,N/A
Glostars,Finland,Helsinki,"Digital Media, Information Technology, Media and Entertainment, Mobile Apps, Photography, Social Media",Between €1-€100K,2021,https://glostars.com/,N/A
Glouv,Netherlands,Amsterdam,"Clean mask on the go, handheld mask sanitization, Store, sanitize, face mask",No funding announced yet,2020,https://www.glouv.com,N/A
Glovdi Technological Innovations,UK,London,"wearable, smartphone, iot",N/A,2015,www.glovdi.com,N/A
Glovo,Spain,Barcelona,"delivery, local goods, city",N/A,2015,www.glovoapp.com,N/A
Glox Therapeutics,UK,Glasgow,"Health, Pharmaceuticals",Between €5 million-€10 million,2023,https://gloxtherapeutics.com/,Active
Gloxy,Ireland,Dublin,"Dating, LGBT, Mobile Apps",No funding announced yet,2021,https://gloxy.app,N/A
Glp4,Italy,Floriano,"News, Telecommunications, Video",No funding announced yet,2019,https://glp4.com,N/A
Glucoactive,Poland,Wroclaw,"Diabetes,Hardware,Health Care",N/A,2016,www.gluco-active.com,N/A
Glucomodicum,Finland,Helsinki,"Health Care, Glucose Monitoring, Medical Device",No funding announced yet,2018,https://glucomodicum.com/,N/A
Glucovibes,Spain,Donostia-san SebastiÃ¡n,"Wellness, Fitness Services, IT, Personal Health",Between €1 million-€ 2.5 million,2021,https://www.glucovibes.com,Active
Glue,France,Helsinki,"VR, Virtual Reality, Simulations, Virtual events, Glue, Helsinki",N/A,2017,https://www.glue.work,N/A
Glue Collaboration,Finland,Helsinki,"Augmented Reality, Collaboration, Hardware, Information Technology, Internet, Meeting Software, Software, Virtual Reality, Virtualization",Between €2.5 million-5 million,2018,https://glue.work,N/A
Gluru,UK,London,"Analytics, Artificial Intelligence, Machine Learning, Software",Between €2.5 million-5 million,2014,http://www.gluru.co/,N/A
Glyco It Services,Germany,Berlin,"Web development, Mobile app development , Digital marketing",No funding announced yet,2021,https://glycoit.com,N/A
Glycoera,Switzerland,Schlieren,"Biotechnology, Information Technology, Life Science",Between €10 million-€25 million,2020,https://glycoera.com,N/A
