company name,category,based in,tags,total funding,founded,website,company status
Ida,Italy,Milan,"Influencer Marketing, PR, Advertisers, Advertisement",No funding announced yet,2016,http://www.idagency.it/,N/A
Idagio,Germany,Berlin,"streaming, classical music, music",N/A,2015,www.idagio.com,N/A
Idatase Gmbh,Germany,Frankfurt,"Analytics, Enterprise Software",No funding announced yet,2017,http://idatase.de/,N/A
Idcanopy,Austria,Vienna,"KYC, KYB, eID, Fintech",No funding announced yet,2024,www.idcanopy.com,Active
Idea Drop,UK,London,"HR Tech, Workflow, Data Management, Idea Drop, London",N/A,2014,www.ideadrop.co,N/A
Idea Invest,Germany,Hamburg,"logistics, storage, digital",N/A,2017,https://stority.de,N/A
Idea Screening Lab,Sweden,Stockholm,"Idea Validation, SEO, Demand Validation",Between €1-€100K,2024,https://ideascreeninglab.com,Active
Ideabuddy,Estonia,Tallin,"Business Plan software, Ideation, Startups, Starting a business",Between €1-€100K,2020,https://ideabuddy.com/,Active
Ideafloat,UK,London,"SaaS, Startup, AI, Business Validation Tools, Business Intelligence, Validation, Growth Hacking, Launch Strategy",No funding announced yet,2024,http://ideafloat.com,Active
Ideal Flatmate,UK,London,"PropTech, Flat Renting, Flat-sharing",N/A,2015,www.idealflatmate.co.uk,N/A
Ideal Web Designs,UK,Warrington,"web design and development, web design, website company, web designer, website design, business website",N/A,2019,https://idealwebdesigns.co.uk/,N/A
Ideal6,UK,Isle of Wight,"affiliate marketing, products reviews",N/A,2018,www.ideal6.co.uk,N/A
Idealdevs,UK,London,Software,No funding announced yet,2023,https://idealdevs.io,Active
Idealex,Estonia,Tallin,"Financial Services, Payments",Between €1-€100K,2021,https://idealex.com/,N/A
Ideamotive,Poland,Warsaw,"Graphic Design, Product Design, Software, Software Engineering, UX Design, Web Design, Web Development",Between €100K-€500K,2014,https://www.ideamotive.com,N/A
Ideas Forward,Greece,Thessaloniki,"Angel Investment, Big Data, Blockchain, Cloud Data Services",No funding announced yet,2019,https://ideasforward.com,N/A
Ideel,France,Paris,"automation, subscriptions",No funding announced yet,2018,https://ideel.io,N/A
Ideiio,UK,Salford,"Information Technology, Software, Lives simple",No funding announced yet,2019,https://ideiio.com/,N/A
Idenfit,Netherlands,The Hague,"Human Resources, SaaS, Software, Virtual Workforce",No funding announced yet,2020,www.idenfit.com,N/A
Idenfy,Lithuania,Kaunas,"ID, identity verification, Fraud, iDenfy, Lithuania",N/A,2017,https://www.idenfy.com,N/A
Idenprotect,UK,Guildford,"Electronics, Information Technology, Security, Software",Between €2.5 million-5 million,2014,http://www.idenprotect.com/,N/A
Identance,UK,London,"Information Technology , Services, Software",No funding announced yet,2018,https://identance.com/,N/A
Identmarket,Germany,Munich,"business materials, advertising items, badges, lanyards",No funding announced yet,2011,https://www.identmarket.de/,N/A
Ideta,France,Paris,"Artificial Intelligence, Information Technology, Machine Learning, Robotics",No funding announced yet,2017,http://meet-ideta.com/,N/A
Idfier,Sweden,Växjö,"Peer-to-Peer Identity Sharing, Secure Online Interactions, Mutual Consent Data Sharing",Between €100K-€500K,2023,https://www.idfier.com/en,Active
Idhubs,France,Paris,"Digital, SaaS, Ecosystems",No funding announced yet,2019,https://idhubs.com/,N/A
Idnow,Germany,München,"Onine ID, Video Identification, eSignature",N/A,2014,www.idnow.io,N/A
Ido Electronics,Poland,"Gdańsk, Poland","R&D, Industry 4.0, IT with OT",No funding announced yet,2010,https://idoelectronics.eu/en/,Active
Idoneo,Spain,La Rioja,"Leasing, Mobility, Cars, Services, Car Rental",No funding announced yet,2019,https://www.idoneo.com,N/A
Idonia,Spain,Palma,"Wellness, Fitness Services, Telemedicine, Software Development",No funding announced yet,2017,https://idonia.com,N/A
Idowaz Technologies,UK,Reading,"Delivery, Transportation, On-demand delivery, food delivery.",No funding announced yet,2019,http://www.idowaz.com,N/A
Idp Creations,Greece,Thessaloniki,"Online Shopping, Arts, Crafts Store",No funding announced yet,2021,https://idpcreations.com,N/A
Idruide,Germany,Monaco,"Education, Information Technology, Internet",No funding announced yet,2017,https://idruide.com,N/A
Idtrust,Netherlands,Lelystad,"Internet, Digital, Investment",No funding announced yet,2020,https://www.idtrust.com,N/A
Idwell,Austria,Vienna,"SaaS, CRM, proptech",N/A,2017,https://www.idwell.com/,N/A
Idyllum Labs,Estonia,Tartu,"Cyber Security, Network Security, Web Development",No funding announced yet,2020,www.idyllum.com/,N/A
Ielts Podcast,UK,London,"ielts, education, essay correction,",No funding announced yet,2014,https://www.ieltspodcast.com/free-essay-check/,N/A
Ienai Space,Spain,Madrid,"Aerospace, Machinery Manufacturing, Space Travel",Between €1 million-€ 2.5 million,2019,http://ienai.space/,N/A
Ierp,Slovakia,Bratislava,"AI, ERP, Algorithm, Sales Forecasting",Between €100K-€500K,2019,www.ierp.ai,N/A
Iethico,UK,London,"Health Care, Information Technology, Machine Learning",No funding announced yet,2020,https://iethico.com,N/A
Ieventro,Romania,Iasi,"events planner,weddings planner,events",Between €1-€100K,2022,https://www.ievent.ro,Active
Iexec,France,Lyon,"Blockchain, Cloud Computing, Software",Between €10 million-€25 million,2016,http://iex.ec/,N/A
If Lastmile,Spain,Madrid,"E-Commerce, Logistics, IT Services",Between €1 million-€ 2.5 million,2020,https://www.iflastmile.com/,N/A
Ifactory3D,Germany,Düsseldorf,"Electronics, Information Technology, Manufacturing, Software",Between €100K-€500K,2020,https://ifactory3d.com/,N/A
Ifarm,France,Helsinki,"FoodTech, Food Science, Vegetables, Farming, iFarm, Helsinki",N/A,2017,https://ifarmproject.com,N/A
Ifeel,Spain,Madrid,"Healthcare, Lifestyle, Personal Health",Between €5 million-€10 million,2017,https://app.ifeelonline.com/employers?locale=en,N/A
Ifesca,Germany,"Ilmenau, Thuringen","Analytics, Artificial Intelligence, Energy, Energy Efficiency, Energy Management, Information and Communications Technology (ICT), Information Technology, Internet of Things",Between €10 million-€25 million,2016,http://www.ifesca.de/,N/A
Iffent,Estonia,Tallinn,"Architecture, Planning, Design",Between €100K-€500K,2019,https://www.iffent.com/,N/A
Ifigenia,Sweden,Stockholm,Health,Above €25 million,2022,https://www.ifigenia.se/,Active
Iflow,Romania,Bucharest,"SaaS, Software",No funding announced yet,2022,https://iflows.com/en/,Active
Iflows,Romania,Bucharest,"SaaS, Software",No funding announced yet,2022,https://iflows.com/en/,Active
Ifollow,France,Gentilly,"Logistics, Robotics,  Retail, Machine Learning",Between €1 million-€ 2.5 million,2017,https://www.ifollow.fr/,N/A
Iframe,Germany,berlin,"IoT Connectivity Solutions, Smart Device Integration, Real-Time Data Monitoring, Scalable IoT Infrastructure",Between €100K-€500K,2024,https://things-connect.net/,Active
Ifunded,Germany,Berlin,"Crowdfunding, Finance, Financial Services, FinTech, Marketplace",Between €2.5 million-5 million,2015,https://ifunded.de,N/A
Ig Cloud Ops,UK,Ellesmere Port,"Cloud consulting, cloud cost optimization, managed cloud hosting, 24/7 technical support",No funding announced yet,2019,https://igcloudops.com/,Active
Igdm Pro,UK,Birmingham,"SaaS, Social Media Automation, Marketing Automation",Between €1-€100K,2025,https://igdm.me/,Active
Igenius,Italy,Milan,"data analysis, analysis technology",No funding announced yet,2016,igenius.ai/,N/A
Igeolise,UK,London,"TravelTech, Trips Organizational Tool, Integration Platform",N/A,2009,http://www.traveltimeplatform.com/,N/A
Igetnow,Germany,Kiel,"Commercial, Food and Beverage, Food Delivery, Software",No funding announced yet,2017,https://igetnow.com/info,N/A
Igloo Energy,UK,Southampton,"Utilities, Smart Energy, Clean Tech, Smart Meters",N/A,2016,www.igloo.energy,N/A
Ignite Data,UK,Reading,"CRM, Health Care, Information Technology, Medical",Between €500K-€ 1 million,2014,https://www.ignitedata.co.uk,N/A
Ignite Procurement,Norway,Oslo,"Information Technology, SaaS, Software",Between €500K-€ 1 million,2016,https://www.igniteprocurement.com/,N/A
Ignitia,Sweden,Stockholm,"Weather App, Weather Forecast, Climate Changing",N/A,2009,www.ignitia.se,N/A
Ignitis Group,Lithuania,Vilnius,"Energy, Energy Management, Manufacturing, Renewable Energy",No funding announced yet,2019,https://www.ignitisgrupe.lt,N/A
Igniv,UK,London,"Real Estate, Technology,",Between €100K-€500K,2021,https://igniv.io/,N/A
Ignize,Luxembourg,Luxembourg,"Software Development, Saas, Analytics, Software",No funding announced yet,2020,https://www.ignize.com/campaign/generic-2,Active
Ignosol Energies Renovables Sl,Spain,Odena,"solar energy, solar plates, aerotermia",Between €1-€100K,2020,https://ignosol.com/,Active
Igoon,Italy,Napoli,"mobility, urban, carpool",N/A,2014,www.igoon.city,N/A
Igotcha,Sweden,Stockholm,"Apps, Augmented Reality, Gaming, Mobile Apps, Virtual Reality, Web Development",Between €2.5 million-5 million,2014,http://www.igotchastudios.com/,N/A
Igs Limited,UK,Dundee,"AgriTech, AgTech, Growth Solutions, Farming, FarmTech",N/A,2013,www.intelligentgrowthsolutions.com,N/A
Igyxos,France,Nouzilly,"Biotechnology, Pharmaceutical",N/A,2017,www.igyxos.com/,N/A
Ihateironing,UK,London,"Home Services, Laundry and Dry-cleaning, Service Industry",No funding announced yet,2013,https://www.ihateironing.com,N/A
Ihomer,Netherlands,Etten,"Software Development, Computer Software, IT",No funding announced yet,2018,https://ihomer.nl/,N/A
Ihuddle,UK,London,"Asset Management, Cryptocurrency, Financial Services, Venture Capital",No funding announced yet,2020,https://www.ihuddle.io,N/A
Iiek Cears,Greece,Patra,"iek, vocational education",Between €1-€100K,2023,https://cears.edu.gr/iek-cears/,Active
Iiinigence,Spain,Valencia,"Information Technology, Mobile Apps, Software",No funding announced yet,2019,https://www.iiinigence.com,N/A
Iindyverse,UK,London,"Cloud Data Services, Content Creators, Marketing, SaaS",Between €1-€100K,2021,https://iindy.co,N/A
Ikigai,France,Paris,"Fitness, Health Care, Wellness",No funding announced yet,2017,https://ikigaiglobal.com/,N/A
Ikiseq,Czechia,Prague,"ikiseq, ikigai, Petr Václavek",Between €100K-€500K,2020,www.ikiseq.com,Closed
Ikkio,Finland,Helsinki,"smart glasses, artifficial intelligence, computer vision",No funding announced yet,2024,https://www.ikkio.co/,Active
Iknowly,Germany,Stuttgart,"career guidance, mentoring, job search, education",Between €100K-€500K,2025,https://www.iknowly.com/,Active
Ikolcrane,Spain,El Puerto de Santa María,"construction, cranes, manufacturing, monitoring",No funding announced yet,2024,https://www.ikolcrane.com/,Active
Iks,Norway,Steinsland,"Finance, Financial Services, Small and Medium Businesses",No funding announced yet,2017,https://www.innkjopssjefen.no/,N/A
Ikuu,Netherlands,Arnhem,"Marketing, Analytics, Sales, Leads",N/A,2018,www.ikuu.io,N/A
Il Botticelli,Spain,Spain,"Machine distributors, Playfulness, Craftsmanship, Precision",Between €100K-€500K,2024,https://www.ilbotticelli.com/,Active
Il Etait Un Fruit,France,Montpellier,"Food and Beverage, Food Processing",Between €1 million-€ 2.5 million,2014,https://www.iletaitunfruit.fr/,N/A
Ilcaffeitaliano,Italy,Milano,"e-commerce, catering, food & Beverage",Between €1 million-€ 2.5 million,2015,https://www.ilcaffeitaliano.com/en,N/A
Illimity,Italy,Milan,"Banking, Financial Services, FinTech",No funding announced yet,2018,https://www.illimity.com/en,N/A
Illuma,UK,London,"Advertising, Advertising Platforms, Machine Learning",Between €1 million-€ 2.5 million,2016,https://weareilluma.com,N/A
Illumina,UK,London,"Vodka, Brand, Food & Beverage",No funding announced yet,2020,http://www.illuminativodkaltd.com/,N/A
Illuminati Vodka,UK,London,"Vodka, Brand, Food & Beverage",No funding announced yet,2020,http://www.illuminativodkaltd.com/,N/A
Illuminem,Italy,Venice,SaaS,Between €1-€100K,2022,https://illuminem.com/,Active
Illumo Robotics,France,Toulouse,"Artificial Intelligence, Industrial Automation, Robotics, Warehousing",No funding announced yet,2020,https://illumorobotics.com/,N/A
Illustroke,Estonia,Harjumaa,"AI, Web Design, Illustrations",No funding announced yet,2023,https://illustroke.com/,N/A
Illwerke Vkw,Austria,Bregenz,"Utilities, Renewable Energy, Electrical Distribution",No funding announced yet,2019,https://www.vkw.at,Active
Ilms,Poland,Sopot,"Artificial intelligence, XR, SaaS",No funding announced yet,2023,https://ilms.app/,Active
Ilof Intelligent Lab On Fiber,UK,Oxford,"medtech, healthtech, alzheimer, medicine",N/A,2019,http://www.ilof.tech/,N/A
Iloh,UK,London,"Health Care, Personal Health, Retail, Wellness",No funding announced yet,2020,https://iloh.co.uk/,N/A
Ilovetrending,France,Lyon,"internet, search traffic",No funding announced yet,2020,https://ilovetrending.com/,N/A
Ilu Space,Finland,Helsinki,"Aerotech, AI, Big Data, Telecommunications",Above €25 million,2021,https://iluspace.com/,Active
Ilumoni,UK,Barnsley,"Fintech, credit data, open banking",No funding announced yet,2019,https://www.ilumoni.com/,N/A
Ilvi Gmbh,Austria,Gleisdorf,"Health Care, Information Technology, Medical Device, mHealth, Software",Between €100K-€500K,2018,https://www.ilvi.io/,N/A
Im Built With Ai,UK,Scotland,"AI, Startup, SaaS",No funding announced yet,2024,https://imbuiltwithai.com/,Active
Im Fine,Romania,Bucharest,"depression, mental health, healthtech",N/A,2018,https://imfine.ascendio.tech,N/A
Im Ok,Italy,"Napoli, Campania","Apps, Business Intelligence, iOS, Location Based Services, Mobile, Restaurants, Retail, Software",Between €500K-€ 1 million,2016,http://imok.fr/,N/A
Image Extender Ai,UK,Londo,"Image Extender AI, Image Expand AI",No funding announced yet,2024,https://expandirimagenconia.online/,Active
Image Reviewer,UK,"London, United Kingdom","image, hosting, sharing",N/A,2015,http://imgreview.com,N/A
Imagebiopsy Lab,Austria,Vienna,"AI, imaging diagnostic, digital health",Between €5 million-€10 million,2017,www.imagebiopsy.com,N/A
Imageens,France,Paris,"Medical Device, Technology,  Medical & Health, AI",Between €500K-€ 1 million,2017,https://www.imageens.com/,N/A
Imagerr Ai,UK,England,"image, AI, alt text, alt, image alt, image alt text, image to text, alt text generator, generate alt text, wordpress, wordpress plugin, ai image, ai alt text",No funding announced yet,2024,https://imagerr.ai,Active
Imagetica,France,paris,"pdf converter, converters,",No funding announced yet,2024,https://imagetica.site/,Idea Stage
Imagicase,Sweden,Stockholm,"Consumer Electronics, Information Technology, Mobile Devices",Between €1-€100K,2018,https://www.imagicase.com/,N/A
Imagilabs,Sweden,Stockholm,"Developers, Edtech, Training",No funding announced yet,2018,https://www.imagilabs.com/,N/A
Imaginario,UK,London,SaaS,Between €1-€100K,2021,https://www.imaginario.ai,N/A
Imagination Machine,France,Nantes,"Internet, finance, Entrepreneur",No funding announced yet,2017,/cdn-cgi/l/email-protection,N/A
Imaginecare,Sweden,Stockholm,"Health Care, Health Diagnostics, Digital Health",Between €5 million-€10 million,2017,https://info.imaginecare.com/,N/A
Imagjn,Netherlands,The Hague,"academic publishing, academic papers",No funding announced yet,2018,https://imagjn.com,N/A
Imagospace,Estonia,Tallinn,"Photography, digital content, creatives, illustrations",No funding announced yet,2023,https://imagospace.com,Active
Imaqen,Finland,Helsinki,"Biotechnology, Health Care, Information Technology, Medical",Between €1-€100K,2016,http://imaqen.com/,N/A
Imarit,Denmark,Copenhagen,"fashion, design, sustainability, ethics",N/A,2015,http://www.imarit.com,N/A
Imaweb,Spain,Madrid,"Information Technology, Service Industry, Software",No funding announced yet,2020,https://www.imaweb.com/,N/A
Imburse,Switzerland,Zurich,"Developer Tools, Enterprise, Enterprise Software",Between €10 million-€25 million,2018,https://www.imbursepayments.com/,N/A
Imcheck Therapeutics,France,"Marseille, Provence-Alpes-Cote d'Azur","Biopharma, Biotechnology, Health Care, Life Science, Therapeutics",No funding announced yet,2015,http://www.imchecktherapeutics.com/,N/A
Imd Biotech,Austria,Vienna,"Biotechnology Research, Healthcare, Pharmaceutical",No funding announced yet,2021,https://imdbiotech.com,Active
Ime,UK,London,"AI Scientist, Scientific Research, Artificial Intelligence, Technology Innovation",Between €500K-€ 1 million,2024,https://ime.life/,Active
Imecxpand,Belgium,Leuven,"Venture Capital, Private Equity Principals, Nanotechnology",Above €25 million,2017,https://imecxpand.com/en,Active
Imed,Spain,Alava,Biotechnology,Between €1-€100K,2014,https://imasmed.com/en/,N/A
Imers Land,Estonia,Estonia,"Computer Games, metaverse, cryptocurrency",Between €100K-€500K,2020,https://imers.land,N/A
Imerso,Norway,Oslo,"construction, digital twin, building",N/A,2014,imerso.com,N/A
Imfan,Slovenia,Ljubljana,"Internet, Social, Web Apps",No funding announced yet,2019,https://imfan.com,Active
Img2Html,Spain,Spain,"image to code ai, productivity, conversion, web design, development",No funding announced yet,2022,https://www.img2html.com/,Active
Imgos,UK,London,"travel, relocation, settle, assistant",No funding announced yet,2023,https://imgos.ai,Active
Imhotex,UK,Cambridge,"Health Care, Pharmaceutical, Virtualization",No funding announced yet,2020,http://imhotex.com,N/A
Imitate Email,UK,Oxford,"developer tool, web tool, user testing, email",No funding announced yet,2022,https://imitate.email,Active
Imm Shoes Made By Immigrants,Spain,Madrid and Paris,"Ethical, sustainable, shoes, ecommerce, social justice",No funding announced yet,2019,www.immshoes.com,N/A
Immedica,Sweden,Stockholm,"Health Care, Medical, Pharmaceutical",No funding announced yet,2018,http://www.immedica.com,N/A
Immedis,Ireland,Dublin,"Financial Services, Human Resources, Information Technology, Outsourcing",Above €25 million,2016,https://immedis.com/,N/A
Immense Simulations,UK,Milton Keynes,"AI, autonomous, solutions",N/A,2016,https://www.immense.ai/,N/A
Immerok,Germany,Berlin,"Cloud Data Services, Developer Platform, Information Technology, Open Source",Between €10 million-€25 million,2022,https://www.immerok.io,N/A
Immersia,UK,Warrington,"Software, Development, Democratize",Between €100K-€500K,2020,https://immersia.co.uk/,N/A
Immersium Studio,Spain,Barcelona,"Augmented Reality, Virtual Reality",No funding announced yet,2018,http://www.immersiumstudio.com,N/A
Immersive,Estonia,Tallinn,"Recruitment, Human Resources, Management Consulting",No funding announced yet,2020,https://www.immersivehiring.com/,N/A
Immersive Display,France,Paris,"VR, headset, hardware",N/A,2016,https://www.immersive-display.com/en/,N/A
Immersive Factory,France,Paris,"Corporate Training, Simulation, Virtual Reality",Between €1 million-€ 2.5 million,2016,https://immersivefactory.com,N/A
Immersive Labs,UK,Bristol,"Cyber Security, Cyber Labs, Development Platform, Identify Talent, Develop Skills",N/A,2016,https://www.immersivelabs.com/,N/A
Immersive Vr Education,Ireland,Waterford,"EdTech, VR, Education, Distance Learning",N/A,2015,www.vreducationholdings.com,N/A
Immo Iq,Belgium,Antwerp,"real estate, brokers, real estate sales",N/A,2018,https://www.immoiq.be,N/A
Immofilter,Belgium,Brussels,"real estate, homes, real estate platform",N/A,2018,https://www.immofilter.be/en/,N/A
Immopop,France,Bordeaux,"Real Estate, agency,  proptech",Between €100K-€500K,2018,https://www.immo-pop.com/,N/A
Immopresenter 3D,Germany,Munich,"Cloud Computing, Information Technology, Software, Virtual Reality",No funding announced yet,2020,immopresenter3d.com/,N/A
Immortal Games,Estonia,Tallinn,"Blockchain, Gaming",No funding announced yet,2019,darkcountry.io,N/A
Immotege,Germany,Leonberg,"Finance, Financial Services, FinTech, InsurTech, Real Estate",Between €100K-€500K,2018,http://immotege.de/,N/A
Immozins,Switzerland,Zurich,"Real Estate, Real Estate Investment",Between €10 million-€25 million,2017,https://immozins.ch/,N/A
Immunebytes,UK,Cressage,"smart contract, contract audit, audit company, audit services",Between €1-€100K,2020,https://immunebytes.com/,N/A
Immuneed,Sweden,Uppsala,"Biotechnology, Health Care, Pharmaceutical",Between €1-€100K,2014,http://immuneed.com,N/A
Immuniweb,Switzerland,Geneva,"Cybersecurity, AI, SaaS, IoT, Security Testing, ImmuniWeb, Geneva",N/A,2019,www.immuniweb.com,N/A
Immuprobe,Switzerland,Zurich,"Biotechnology, Health Diagnostics, Medical Device",Between €1-€100K,2016,http://www.immuprobe.ch/,N/A
Imobilisco,France,Nice,"real estate, saas, marketplace, international",Between €100K-€500K,2008,https://www.imobilisco.com,Active
Imok,Italy,Naples,"Cash-flow, Ecommerce, IOT People",Between €500K-€ 1 million,2020,https://www.imok.fr/,N/A
Imop,France,Paris,"Real Estate, agency,  proptech",No funding announced yet,2018,https://www.imop.fr/,N/A
Imove,Norway,Bergen,"SaaS, Software, Transportation",Between €1 million-€ 2.5 million,2018,https://imove.eco/,N/A
Imovendo,Portugal,"Lisboa, Lisboa","Real Estate, Real Estate Investment, Properties, Apartments, Houses, Technology",No funding announced yet,2017,https://www.imovendo.pt,N/A
Impact,Germany,England,"Service Industry, Social",No funding announced yet,2017,https://www.impactreporting.co.uk,N/A
Impact Extend,Denmark,Copenhagen,"Digital Marketing, Marketing Automation, SEO",No funding announced yet,2018,https://www.impactextend.dk/,N/A
Impact Investing Solutions,Switzerland,Zug,"Business Consulting, Services, Coaching, Training",Between €100K-€500K,2020,https://iisolutions.ch,N/A
Impact Plus,France,Paris,Purpose,Between €2.5 million-5 million,2020,https://impact-plus.fr/en/homepage-uk/,Active
Impactbee,Germany,Berlin,"fundraising, nonprofits, charity, impact",Between €500K-€ 1 million,2023,https://impactbee.org,Active
Impactbuying,Netherlands,Alkmaar,"Advice, Consulting, Procurement, Retail",No funding announced yet,2020,https://impactbuying.com/,N/A
Impactful,Germany,Berlin,"Technology, Information, Internet, SaaS",No funding announced yet,2023,https://www.beimpactful.de,N/A
Impacthero,Germany,Berlin,"Environmental Services, Tree Planting, Environmental Awareness",Between €100K-€500K,2020,https://www.impacthero.com/,N/A
Impactin,France,Paris,"Fintech, Insurtech, Sustaintech, Sustainability",No funding announced yet,2019,impactin.co,N/A
Impactmarket,Portugal,Braga,"Cryptocurrency, Fintech, SaaS",Between €2.5 million-5 million,2020,https://www.impactmarket.com/,Active
Impala,UK,London,"Developer APIs,Hospitality,SaaS",Above €25 million,2016,www.getimpala.com,N/A
Impargo,Germany,Potsdam,"Logistics software, TMS software",Between €100K-€500K,2017,www.impargo.de,N/A
Impeller Labs,UK,London,"Strategy, Revenue growth, Operations",No funding announced yet,2023,https://www.impeller.io/,N/A
Imperfect Ceo Club,UK,London,"Women Entrepreneurs, Professional Networking, Leadership Development, Female Empowerment",Between €100K-€500K,2024,https://www.imperfect.ceo/,Active
Imperfect Ceo Women,UK,London,"women, communities, platform",No funding announced yet,2023,https://www.imperfect.ceo,Active
Imperfectus,Spain,Bellpuig,"Agriculture, E-Commerce, Farming, Retail",No funding announced yet,2020,www.imperfectus.es,N/A
Imperia,Spain,Valencia,"Supply chain, Demand Planning, Forecasting, tock optimization",Between €2.5 million-5 million,2019,https://imperiascm.com/,Active
Imperion,Austria,Vienna,"Consulting, IT, SOftware",No funding announced yet,2019,https://www.imperion.eu/,Active
Imperium Media,UK,"Bury, West Sussex","Advertising, Augmented Reality, Developer APIs, Digital Media, Enterprise Applications, Marketing, Video, Web Development",Between €100K-€500K,2016,http://www.imperiummedia.media,N/A
Imperix,Switzerland,Rue de la Dixence 10,"Electronics, Power Grid, Prototyping, Software Development",No funding announced yet,2013,https://imperix.com,N/A
Implica Global Corporation,Estonia,Tallinn,"IT, Marketing, Strategy Consulting",No funding announced yet,2023,www.implicaglobalcorp.com,Active
Implicity,France,Paris,"Health Care, Information Technology, Medical, Software",Between €2.5 million-5 million,2016,www.implicity.com,N/A
Impliedoptions,Finland,Helsinki,"options, saas, fintech, option analytics",Between €1-€100K,2025,https://impliedoptions.com,Active
Implify,Germany,Frankfurt,"Dental, Medical, Medical Device",No funding announced yet,2020,www.implify.de,N/A
Implisense,Germany,Berlin,"Big Data Analytics, Real-Time Monitoring, Predictive data mining",N/A,2013,http://www.implisense.com,N/A
Impltech,Germany,Berlin,"Consulting, FinTech, Information Technology, Mobile Apps, Software, Web Development",No funding announced yet,2017,https://impltech.de,N/A
Impossible Bakers,Spain,Barcelona,"keto, bakery, pastry, low-carb",No funding announced yet,2021,https://www.impossiblebakers.com/,Active
Impossibrew,UK,London,"ECommerce, Food, Drink",No funding announced yet,2024,https://impossibrew.co.uk/,Active
Imprend,UK,London,"handover, transition plan, offboarding",Between €1-€100K,2022,www.imprend.com,N/A
Impresm,Switzerland,Zurich,"Digital Marketing, Financial Services, Next Generation",No funding announced yet,2020,https://www.impresm.com/,N/A
Impress,Spain,Barcelona,"orthodontic, impress, invisible",No funding announced yet,2021,https://smile2impress.com/es,N/A
Impressoracorp,Spain,Madrid,"Impressoras EMultifuncionais, Cartuchos EToners Originais, Frete Gratis ENacional",Between €500K-€ 1 million,2023,https://www.impressora.com.br/,Active
Imprice,Italy,Milan,"dynamic pricing, AI, ML",No funding announced yet,2019,https://imprice.ai/,N/A
Imprima,Italy,Milan,"Textile Printing, Textile Finishing, Textiles, Innovation",No funding announced yet,2017,http://www.imprima.group/,N/A
Imprimakers,Spain,Valencia,"3D Printing, Printing",No funding announced yet,2018,https://imprimakers.com,N/A
