company name,category,based in,tags,total funding,founded,website,company status
Glycozen Infotech,Germany,Berlin,"Innovative IT Solution development, CRM Solutions, Cloud based business Management,Dynamics 365",No funding announced yet,2022,www.glycozen.com,N/A
Gmelius,Switzerland,Geneva,"inbox, CRM, communication",N/A,2018,https://gmelius.com,N/A
Go Autonomous,Denmark,Copenhagen,"B2B, E-Commerce Platforms, SaaS, Software",No funding announced yet,2020,https://goautonomous.io,N/A
Go Dogo,Denmark,Kongens Lyngby,"Computer Vision, Consumer Electronics, Internet of Things, Pet",No funding announced yet,2018,https://go-dogo.com/,N/A
Go Exporting,UK,United Kingdom,"exporting, export services, import export, export consultancy",N/A,2019,https://goexporting.com/,N/A
Go Get Me It,UK,Liverpool,"Home Services, Internet, Property Management, Software",Between €100K-€500K,2020,http://www.gogetmeit.com,N/A
Go Instore,UK,London,"E-Commerce, Retail",No funding announced yet,2014,https://www.goinstore.com,N/A
Go Legal Ai,UK,London,"Legal Ai, Legal Services, AI, Ai Lawyer",No funding announced yet,2023,https://go-legal.ai/,Active
Go Lemon,Netherlands,Laren,"Subscription, Devices, Dutch",N/A,2017,https://www.go-lemon.nl/,N/A
Go North,Sweden,Goeteborg,"E-Commerce, Manufacturing, Entrepreneurs",Above €25 million,2020,https://gonorth.co/,N/A
Go Pontio,Spain,Madrid,"Financial Services, Product, Fintech",Between €100K-€500K,2021,https://www.gopontio.com/en/,Active
Go Ramp,Lithuania,Vilnius,"Logistics, Supply Chain management, Cloud Solution",Between €100K-€500K,2016,https://goramp.eu/,N/A
Go Remotical,Spain,Vecindario,"remotework, futureworkplace, remote, remotical",No funding announced yet,2021,https://go-remotical.com/,N/A
Go Sharing,Netherlands,Amsterdam,"Last Mile Transportation, Mobile Apps, Transportation",No funding announced yet,2019,go-sharing.nl,N/A
Go Touch Vr,France,Lille,"VR, Industrial, Simulation",N/A,2017,https://www.gotouchvr.com/,N/A
Go Zero Waste,Spain,Barcelona,"Apps, Lifestyle, Waste Management",No funding announced yet,2018,https://gozerowaste.app/,N/A
Go2Insure,Slovenia,Ljubljana,"Finance, Financial Services, Insurance",No funding announced yet,2019,https://www.go2insure.net/,N/A
Go4Clic,Spain,"argentina, spain","digital education, innovation, platform",Between €1-€100K,2019,www.go4clic.com,N/A
Go4Loyal,Estonia,Tallinn,"Travel, Hospitality, Logistic, Hotels",Between €100K-€500K,2023,https://www.go4loyal.com/,Active
Go4Mobile,Switzerland,Bern,"Mobility, Sustainable Solution, CleanTech",N/A,2008,https://www.go4mobile.ch,N/A
Goal Manager,UK,Manchester,SaaS,Between €2.5 million-5 million,2019,https://goalmanager.co.uk/,Active
Goalifi,Switzerland,Zurich,"Finance, Financial Services, Personal Finance",No funding announced yet,2020,https://www.goalifiapp.com/,N/A
Goals,Sweden,Stockholm,"Gaming, Online Games, Computer Games",Between €10 million-€25 million,2021,https://goals.co/,N/A
Goalse,Estonia,Estonia,"production, capacity, digital",N/A,2015,http://goalse.com,N/A
Goalswon,Portugal,Lisbon,"coaching,accountability,productivity,wellness",No funding announced yet,2020,https://www.goalswon.com/,Active
Goaltotal,Lithuania,Vilnius,"Gambling, Internet, Mobile Apps, Soccer",No funding announced yet,2020,goaltotal.com,N/A
Goaudits,UK,London,"Apps, Information Technology, Public Safety, Quality Assurance, SaaS, Software",No funding announced yet,2016,https://goaudits.com,N/A
Goava,Sweden,Stockholm,"Artificial Intelligence ,Machine Learning, Sales, Software",Between €500K-€ 1 million,2016,goava.com,N/A
Goaz,Spain,Pais Vasco,"Apps, Social Network, Travel",No funding announced yet,2018,https://goazsocial.com/,N/A
Gobaba,UK,London,"Finance, Financial Services, Internet",No funding announced yet,2018,https://www.gobaba.com/,N/A
Gobeltrip,Spain,Madrid,Travel,Between €2.5 million-5 million,2017,https://gobeltrip.com/,Active
Gobi Technologies,Norway,Oslo,"Social Media, Entertainment, TV shows",N/A,2015,www.gobistories.co,N/A
Goboony,Netherlands,Utrecht,"camper, motorhome, rent",N/A,2015,www.goboony.nl,N/A
Gobox,Denmark,Copenhagen,"Cloud Storage, Logistics, Warehousing",Between €1 million-€ 2.5 million,2014,https://gobox.dk/,N/A
Gobuyed,Portugal,Lisbon,"BID, Sell, fast.",Between €100K-€500K,2021,conectcond.com.br,N/A
Gobybike,Finland,Espoo,"Service Industry, Spectator Sports, Cost-Efficient and Fun",Between €500K-€ 1 million,2020,https://gobybike.fi/,N/A
Gocardless,UK,London,"FinTech, Online Payments, Direct Debts, GoCardless, London",N/A,2011,www.gocardless.com,N/A
Gocertify,UK,"London, England","Digital Marketing, Marketing, Software",No funding announced yet,2020,https://gocertify.me,N/A
Gocleer,Spain,Barcelona,"insurance, behavioral science, telematics, digital distribution",Between €500K-€ 1 million,2020,https://gocleer.com/,N/A
Gocontractor,Ireland,Dublin,"HR Tech, Onboarding, Construction",N/A,2012,www.gocontractor.com,N/A
Gocrypto,Slovenia,Ljubljana,"Blockchain, Cryptocurrency, Mobile Payments",N/A,2017,https://gocrypto.com/en,N/A
Gocustomized,Netherlands,"Amsterdam, Netherlands","Phone Cases, Customised Design, eCommerce",N/A,2012,https://www.gocustomized.co.uk/,N/A
Goddard Discovery,Austria,Hagenberg,"Artificial Intelligence, Machine Learning, Application Development",No funding announced yet,2022,https://www.goddard-discovery.ml/,N/A
Godiet,Estonia,Tallinn,"diet,b2b,meat-plan",No funding announced yet,2020,https://godiet.eu,N/A
Godot,Austria,Vienna,"DeepTech, Wellbeing, Behaviour Change",Between €2.5 million-5 million,2023,godot-austria.com,Active
Goeat,Switzerland,Luzern,"goeatme, ICT, travel tech, consumer service",No funding announced yet,2018,www.goeat.me,N/A
Goeat Me,Switzerland,Luzern,"E-Commerce, Food and Beverage, Information Technology, Internet, Software, Travel",No funding announced yet,2018,https://www.goeat.me/,N/A
Goelektrik Wallbox Installation,Germany,Berlin,"Wallbox, Charging-Station, EV-Charging, Installation-Service",No funding announced yet,2023,https://goelektrik.de/,Active
Goeuro,Germany,Berlin,"TravelTech, Search Engine, Travel Comparison Tool",N/A,2012,http://www.goeuro.co.uk/,N/A
Gofido,Sweden,Stockholm,"Insurance, Risk Management, Insurtech, Partnership",No funding announced yet,2019,https://www.gofido.se/,N/A
Goflux,Germany,Cologne,"Hospitality, Mobile Apps, Ride Sharing, Sustainability, Transportation",No funding announced yet,2017,https://goflux.de,N/A
Gofreedly,Ireland,Dublin,"travel, distribution platform, ecommerce,",No funding announced yet,2019,www.gofreedly.com,N/A
Gofreedly Bookings,Ireland,Dublin,"Travel Arrangements, Tours, Activities",Between €100K-€500K,2019,https://www.gofreedly.com/,N/A
Gofrendly,Sweden,Stockholm,"Computer, Social Network, Software",Between €2.5 million-5 million,2016,https://www.gofrendly.com,N/A
Gogetsale,UK,United Kingdom,"Online Shopping, Social Network, Affiliate Marketing",N/A,2012,http://www.gogetsale.com,N/A
Gogetters,UK,"Harlow, Essex","E-Commerce, Internet",No funding announced yet,2016,https://gogetters.co.uk/,N/A
Goggo Network,Germany,Berlin,"Automotive, E-Commerce, Service Industry, Subscription Service",Above €25 million,2018,https://goggo.network/,N/A
Gogonano,Estonia,Tallinn,"nano coatings, nanotechnology, shoe protector, hydrophobic protection",No funding announced yet,2013,https://www.gogonano.com,N/A
Gohenry,UK,Lymington,"FinTech, Financial Education, Youth products",N/A,2012,www.gohenry.co.uk,N/A
Gohire,UK,Swinegate,"hiring software, recruitment software, ATS, application tracking system",No funding announced yet,2018,https://gohire.io/,N/A
Gohub,Spain,Valencia,Information Technology,No funding announced yet,2019,http://gohub.tech/es/,N/A
Goi,Spain,Madrid,"Information Technology, Last Mile Transportation, Logistics",Between €100K-€500K,2016,https://www.letsgoi.com,N/A
Goin,Spain,Barcelona,"machine learning, fintech, saving, app",N/A,2017,www.goin.app,N/A
Gojammin,Poland,Warsaw,"culture tech, event discovery, AI recommendations, entertainment",Between €1-€100K,2024,gojammin.com,Active
Gojob,France,Aix-en-Provence,"HR Tech, Sourcing, Freelance, Temporary job, Gojob, Aix-en-Provence",N/A,2015,https://gojob.com,N/A
Gokart,UK,London,Food and Beverage,Between €100K-€500K,2014,https://www.getgokart.com/gokart/,N/A
Gokind,Sweden,Stockholm,"Financial Services, Information Services, Information Technology,Software",No funding announced yet,2021,https://www.gokind.co/,N/A
Golan Ai,France,Paris,"AI Image, AI Video, AI Art, Golan AI",No funding announced yet,2024,https://www.golan.ai,Active
Golbriak Space,Estonia,Tallinn,Aerotech,Above €25 million,2017,https://golbriak.space/,Active
Goldbaum,Luxembourg,Roeser,"Research, Financial Markets, Financial Products, Automation, Machine Learning, and Cloud",N/A,2018,https://golden.goldbaum.app/,N/A
Golden Malt,Finland,Oulu,"Food Processing, Gluten-Free, High Quality",No funding announced yet,2019,https://www.goldenmalt.fi,N/A
Golden Sparrow,Latvia,Riga,"AgriTech, Precision Agriculture, Blockchain",Between €1-€100K,2021,http://goldensparrow.lv,Active
Golden Whale Productions,Austria,Vienna,"Data Science, Machine Learning, Gaming, iGaming",No funding announced yet,2022,http://www.goldenwhale.com,Active
Goldesthetic,Switzerland,Geneva,"Beauty Salon, Beauty, Treatments",No funding announced yet,2009,https://www.goldesthetic.ch,N/A
Goldex,UK,London,"Marketplace, Trading Technology, Invest",N/A,2014,www.goldexapp.com,N/A
Goldfizh,Netherlands,Utrecht,"Advertising, Digital Marketing, Online marketing",No funding announced yet,2016,http://www.goldfizh.nl/,N/A
Goldie Tech,Germany,Berlin,"Financial Services, Fintech, wealth preservation",Between €100K-€500K,2021,https://www.goldie-tech.com,N/A
Goldilock,UK,London,"Cybersecurity, Data Security, SaaS",Between €1 million-€ 2.5 million,2020,http://www.goldilock.com,Active
Goldn,Germany,Heidelberg,"Chemical, Cosmetics",Between €1 million-€ 2.5 million,2021,https://goldn.com,N/A
Golearn Education,UK,London,"Literacy, Language, Formative, Ai",Between €500K-€ 1 million,2019,www.golearn.guru,N/A
Golee,Italy,Milano,"Information Technology, Software, Sports",Between €1 million-€ 2.5 million,2018,https://golee.it/,N/A
Golem Factory,Poland,Warsaw,"Cryptocurrency, Information Services, Information Technology, Software",Between €10 million-€25 million,2016,https://golem.network/,N/A
Golfee,Spain,Madrid,"Software Development, Mobile App, Digital",Between €100K-€500K,2021,https://www.golfeeapp.com/,Active
Golfmanager,Spain,Madrid,"Cloud Management, Marketing, Software",No funding announced yet,2018,https://golfmanager.com,N/A
Golfscape,UK,"London, U.K.","TravelTech, Golf Community, Sport Training",N/A,2012,http://golfscape.com,N/A
Golfstrom,Germany,Munich,"Fintech, Purpose",Above €25 million,2017,https://golfstrom.solar/,Active
Goliver Therapeutics,France,Nantes,"Biotechnology, Health Care, Pharmaceutical",No funding announced yet,2017,https://golivertx.com/,N/A
Goliving,Germany,Berlin,"Real Estate, Rental, Rental Property",No funding announced yet,2019,https://goliving.eu/,N/A
Golocate,UK,London,"Fleet Management, Geospatial, GPS, Information Technology, Software, Sustainability",No funding announced yet,2021,http://www.getgolocate.com,N/A
Golovaai,Spain,Barcelona,"b2b, saas, crm, erp",No funding announced yet,2024,https://golova.ai,Active
Goma,Portugal,Évora,"Web Design, Web Development, IOS Programming",No funding announced yet,2017,https://gomadevelopment.pt/,N/A
Gomet,Denmark,Valencia,"Apps, Education",No funding announced yet,2019,http://www.gomet.es/,N/A
Gomontir,Hungary,Debrecen,"Information Technology, InsurTech, Mobile Apps, Service Industry",Between €100K-€500K,2018,http://www.gomontir.com/,N/A
Gomoto,Germany,Berlin,"Digital Auction, Car Sales, Simultaneously",Between €100K-€500K,2023,https://www.getgomoto.de/,N/A
Gomypartner,France,Lille,"Recreation, Retail, Shopping, Sports",Between €1 million-€ 2.5 million,2018,https://www.gomypartner.com/,N/A
Gondoli,UK,London,"travel, media, ota",No funding announced yet,2018,www.gondoli.com,N/A
Gonexos,Germany,Augsburg,"Software, Internet, Communication",No funding announced yet,2022,https://gonexos.com/,N/A
Gong Gaming,Bulgaria,Sofia,"Software Development, Gaming, IT",No funding announced yet,2020,https://www.gonggaming.com,Active
Gonnado,Switzerland,Bern,"Affiliate Marketing, Coupons, Lead Generation, Retail Technology",Between €2.5 million-5 million,2014,http://gonnado.com,N/A
Gonnaorder,Netherlands,Amsterdam,"E-Commerce, Food and Beverage, Food Delivery, Hospitality",Between €100K-€500K,2020,http://gonnaorder.com/,N/A
Gonow,Spain,Barcelona,"app, local economy, small business, surroundings",No funding announced yet,2018,https://gonowpro.com/,N/A
Gonuggets,Luxembourg,Luxembourg,"E-commerce, Operating System, Brands",No funding announced yet,2022,https://www.gonuggets.co,N/A
Good Club,UK,London,"Consumer Goods, Grocery, Wholesale",N/A,2019,www.goodclub.co.uk,N/A
Good Crypto,Spain,Tortola,"Android, Blockchain, Cryptocurrency, iOS",No funding announced yet,2018,https://goodcrypto.app,N/A
Good Grants,Malta,Naxxar,"Grants, SaaS, Software",No funding announced yet,2020,https://www.goodgrants.com,N/A
Good Monday,Denmark,Copenhagen,"Business Development, Innovation Management, Office Administration",N/A,2018,www.goodmonday.io/,N/A
Good Sheet,UK,Poland,"finance, Financial, Money Management",No funding announced yet,2023,https://goodsheet.app,Active
Good Spot Mobile Hotel,Poland,Wroclaw,"mobilehotel, sustainable, ecology, self-sufficient",Between €500K-€ 1 million,2021,https://goodspot.pl/en/,N/A
Good Tech Lab,France,Paris,"Artificial Intelligence, Impact Investing, Information Technology, Social Impact",No funding announced yet,2017,http://goodtechlab.io/,N/A
Goodbytz,Germany,Hamburg,"Assistive Technology, Cooking, Robotics",Between €1 million-€ 2.5 million,2021,https://goodbytz.com/,N/A
Goodcarbon,Germany,Berlin,"CleanTech, Information Technology, Sustainability",Between €2.5 million-5 million,2021,https://www.goodcarbon.earth/,N/A
Goodcloudstorage,UK,Liverpool,"technology, cloud, hosting, backup, storage",N/A,2014,https://www.goodcloudstorage.net/,N/A
Goodcourse,UK,London,"Micro-learning Platform, E-learning",Between €500K-€ 1 million,2021,https://www.goodcourse.co.uk/,N/A
Gooddollar,UK,London,Blockchain,Between €500K-€ 1 million,2017,https://www.gooddollar.org/#home,N/A
Goodfeed,Sweden,Gothenburg,SaaS,Between €100K-€500K,2021,https://goodfeed.io/,Active
Goodiebox,Denmark,"Copenhagen, Amsterdam","Beauty Tech, Cosmetic Products, eCommerce, Gifts",N/A,2012,www.goodiebox.dk,N/A
Goodio,Finland,Helsinki,"Chocolate, Health, Ice Cream, Nutrition",N/A,2015,http://www.goodio.fi/,N/A
Goodip Gmbh,Germany,Munich,"AI, Patent, Legaltech",No funding announced yet,2017,www.goodip.de,N/A
Goodlord,UK,London,"rental, real estate, agency",N/A,2014,goodlord.co,N/A
Goodnews,Spain,Madrid,"Press, Healthy, Innovative",Between €500K-€ 1 million,2020,https://goodnews.coffee/,N/A
Goodnews Coffee,Spain,Barcelona,"Coffee, Retail, Press, Food",Between €2.5 million-5 million,2020,https://www.goodnewsco.es,N/A
Goodnick,UK,London,Health,Between €1 million-€ 2.5 million,2021,https://www.thegoodnick.com/,Active
Goodones,Sweden,Varberg,"Dating app, Matching platform, Secure",N/A,2017,www.goodones.se,N/A
Goodprint,UK,"London, UK","Business Cards, Professional Contacts, Graphic Design",N/A,2014,http://www.goodprint.com,N/A
Goodtalent,UK,Swindon,"Human Resources, Information Technology, Recruiting, SaaS",No funding announced yet,2020,http://gtco.net/,N/A
Goodup,Netherlands,Amsterdam,"Employment, Project Management, Employee engagement",No funding announced yet,2017,https://www.goodup.com/,N/A
Goodvest,France,Paris,"FinTech, GreenTech, investment",No funding announced yet,2020,https://goodvest.fr/,N/A
Goodvidio,UK,Sheffield,"online, retail, brands",N/A,2014,https://goodvid.io/,N/A
Goodwall,Switzerland,Geneve,"Career Planning, Education, Internet, Robotics, Social Entrepreneurship, Social Network",No funding announced yet,2014,https://www.goodwall.io,N/A
Goodx Finance Network,Switzerland,Zug,"Bitcoin, Blockchain, Cryptocurrency, Financial Exchanges, Financial Services, FinTech, Mobile Payments, Payments, Personal Finance",No funding announced yet,2018,https://www.goodx.network/,N/A
Gookay,Switzerland,Crans,"Catering, Service Industry, Individual Family Services",No funding announced yet,2020,https://gookay.ch,N/A
Goomyx,Belgium,Harelbeke,"Software, Websites, Consulting",Between €100K-€500K,2021,https://goomyx.com/,N/A
Goota,Ireland,Dublin,"Advertising, Marketing, Marketing Automation",No funding announced yet,2021,https://goota.cloud/,N/A
Goparcel,Ireland,Dublin,"Delivery, Internet, Shipping",No funding announced yet,2019,http://www.goparcel.ie/,N/A
Goparity,Portugal,Lisbon,"Investment, financing, impact, SDGs",Between €500K-€ 1 million,2017,https://goparity.com/en,N/A
Gopf,Switzerland,Lucerne,"NLP, AI, Unstructured Data, Data ScienceArtificial Intelligence",No funding announced yet,2023,https://gopf.ai/,N/A
Gophr,UK,London,"B2B, Courier Service, Delivery, Logistics, Same Day Delivery",Between €5 million-€10 million,2014,https://uk.gophr.com/,N/A
Gopili,France,Rennes,"TravelTech, Search Engine, Cheap Flights, KelBillet, Gopili, Rennes",N/A,2014,www.gopili.com,N/A
Goplugable,UK,Dundalk,"Professional Services, Scientific, Technical Services, Industrials & Manufacturing",Between €100K-€500K,2023,https://www.goplugable.com/,Active
Goramp,Lithuania,Vilnius,"Logistics, Supply Chain, Transportation, GoRamp, Vilnius",N/A,2017,https://main.goramp.eu,N/A
Gorilla,Belgium,Antwerp,"Information Technology, Internet, Software",Between €5 million-€10 million,2018,https://gorilla.co,N/A
Gorilla Technologies,Italy,Modena,"Brand Marketing, Information Technology, Mobile Apps, Web Development",No funding announced yet,2016,https://www.gorillatech.io/,N/A
Gorillas,Germany,Berlin,"Delivery, Grocery shopping, Online Cart",Above €25 million,2020,https://gorillas.io/,N/A
Gorjbiz,Romania,Târgu Jiu,"economic, web development, business",No funding announced yet,2019,www.gorjbiz.ro,N/A
Gorodata,Portugal,Cascais,"AI, Marketing, Sales",Between €100K-€500K,2020,https://gorodata.com/,N/A
Goroom,Denmark,Københoved,"Real Estate, agency, housing",No funding announced yet,2020,https://goroom.dk/,N/A
Gosavex,UK,London,"personal finance, savings, returns, fintech, budget, loans",N/A,2020,https://gosavex.com,N/A
Goscore,Norway,Bergen,"Finance, Financial Services, FinTech, Risk Management",No funding announced yet,2019,https://goscore.me/,N/A
Goshaba,France,Paris,"Consulting, Human Resources, Information Technology",Between €1-€100K,2014,https://goshaba.com/en/goshaba-solutions-de-recrutement-et-gestion-de-competences-2/,N/A
Gosimplo,Denmark,Copenhagen,"Analytics, Data Visualization, Software",Between €2.5 million-5 million,2020,https://gosimplo.com/,N/A
Gosolo Smart Business Account,UK,London,"business, banking, invoicing, account",No funding announced yet,2019,https://gosolo.net,N/A
Gospel Technology,UK,London,"Cyber Security, Software",Between €5 million-€10 million,2016,http://gospel.tech,N/A
Gospoort,Denmark,Copenhagen,"sports, training",No funding announced yet,2016,https://www.gospoort.dk/,N/A
Gosquared,UK,London,"analytics, marketing automation, saas, live chat",N/A,2008,https://www.gosquared.com,N/A
Goss,UK,London,"Gaming, Mobile Apps",No funding announced yet,2018,https://www.goss.media/,N/A
Gostartup Osakeyhti,Finland,Helsinki,"startup, productivity tool, startup community, saas",Between €1-€100K,2021,https://gostartupco.com,N/A
Gostudent,Austria,Vienna,"EdTech, Tutoring Platform, AI, Online Education",N/A,2016,www.gostudent.org,N/A
Gosu,Lithuania,Vilnius,"AI, Gamification, Machine Learning, Analytics, Gaming Data, Gosu.ai, Vilnius",N/A,2017,https://gosu.ai,N/A
Gotalent,UK,"London, England","Human Resources, Internet, Marketplace, Recruiting",Between €1-€100K,2020,https://www.gotalent.com,N/A
Gotcourts,Switzerland,Zurich,"Marketplace, Sports Management, Social Network, Booking Courts",N/A,2014,www.gotcourts.com,N/A
Goteam,Spain,Puebla De Vallbona,"Human Resources, Discounts, Benefits for employees",No funding announced yet,2021,https://www.goteam.es/,Active
Gothumbnails,Netherlands,"Amsterdam, North Holland","youtube thumbnails, ai thumbnail generator, click-through rate",No funding announced yet,2024,https://gothumbnails.com/,Active
Gotikket,UK,London,"Software, Travel, bus tickets",No funding announced yet,2020,https://gotikket.com/,N/A
Goto Lcs,Germany,Munich,"Artificial Intelligence, E-Learning, Machine Learning, Software, Software Engineering",No funding announced yet,2020,https://livecodestream.dev/,N/A
Gotothisguy,Netherlands,Amsterdam,"E-Commerce Platform, Media, Directory, Marketing, Professional Services, Platform, Search Engines",No funding announced yet,2021,https://www.gotothisguy.com,N/A
Gotripland,Spain,Sevilla,Smart Tourism,N/A,2020,https://5e008b7cc4692.site123.me/,N/A
Gotune,Germany,Berlin,"Music, Music Studios, Marketplace, Booking Platform",No funding announced yet,2023,https://gotune.io,N/A
Gouach,France,Bordeaux,"soft mobility, electronic waste, battery",Between €2.5 million-5 million,2018,https://www.gouach.com/,N/A
Gourmey,France,Paris,"Food and Beverage, Life Science, Food Production",No funding announced yet,2019,https://gourmey.com/,N/A
Gousto,UK,London,"FoodTech, Cooking Recipes, Food Delivery",N/A,2012,www.gousto.co.uk,N/A
Govar Speaking Practice Club,Slovenia,Bratislava,"Online English Speaking Club, Real-Time Conversation Sessions, Confidence-Building Communication",Between €100K-€500K,2024,https://govar.online/,Active
Govmind,Germany,Berlin,"Consulting, Government, GovTech, Software",No funding announced yet,2020,https://govmind.tech/?lang=en,N/A
Govolt,Italy,Milan,"mobility, sustainability, scooter-sharing",Between €500K-€ 1 million,2017,https://www.govolt.it/en/index/,N/A
Govradar,Germany,Munich,"GovTech, Software, SaaS",Between €500K-€ 1 million,2020,https://govradar.net,N/A
Govrn,Belgium,Brussels,"Board, management, software",No funding announced yet,2020,www.govrn.com,N/A
Govwise,Portugal,Lisbon,"Data Analytics, Big Data, Software",Between €1-€100K,2017,https://en.govwise.biz/,N/A
Gowago,Switzerland,Zurich,"Automotive, Car Sharing, Leasing, Subscription Service",No funding announced yet,2017,https://gowago.ch/,N/A
Gowithflow,Portugal,Leça Da Palmeira,"Computer Software, Sustainable Mobility Management, IT",Between €2.5 million-5 million,2019,https://gowithflow.io/,N/A
Goyaa,Germany,Hamburg,SaaS,Between €100K-€500K,2022,https://www.goyaa.ai/,Active
Goyalab,France,Talence,"spectrometry, spectroscopy, sciences, innovation",Between €100K-€500K,2018,https://www.goyalab.com/,N/A
Gozipper,UK,London,Health Care,No funding announced yet,2018,https://www.gozipper.co.uk/,N/A
Gpa Innova,Spain,Barcelona,Machinery Manufacturing,Between €1 million-€ 2.5 million,2015,https://www.gpainnova.com/,N/A
Gpbox,UK,London,"Marketplace, Formula 1, E-commerce",No funding announced yet,2018,https://www.thegpbox.com/,Active
Gplclub,UK,London,"Open Source, WordPress Plugins, Web Development",N/A,2012,https://gplclub.org,N/A
Gpo Technologies,Estonia,Tallinn,"IoT, Mobile app, Cloud solution",N/A,2020,https://www.gpo-tech.com/iot-hub/,N/A
Gpro Global,Slovakia,Kosice,"Asset Management, Automotive, Logistics, Manufacturing",No funding announced yet,2021,https://www.gprotechnologies.com/,N/A
Gpt Workspace,Switzerland,Zug,Saas,No funding announced yet,2024,https://gpt.space/,Active
Gpts Finder,Croatia,Zagreb,"AI, GPTs, Artifical Inteligence, Directory, Search Engine",No funding announced yet,2023,https://gptsfinder.net,Active
Gpu Cloud Pricing,Bulgaria,kong,"AI,API&Data",No funding announced yet,2024,https://www.gpucloudpricing.com/,N/A
Gpu Minining,UK,London,"Mining, Exchanging, Trading",No funding announced yet,2018,https://www.gpumining.website/,N/A
Graalsystems,France,Neuilly-sur-seine,"Data Analytics, Financial Services, Marketing and Sales",No funding announced yet,2022,https://graal.systems/,N/A
Graapz,France,Paris,"Food, Food waste, Trades",N/A,2017,https://www.graapz.com/fr/,N/A
Grabahome,Croatia,Zagreb,"real estate, proptech, marketplace",No funding announced yet,2021,www.grabahome.com,N/A
Grabspace,Ireland,Dublin,"Marketplace, Tenants, Landlords, Community",No funding announced yet,2022,https://grabspace.powerappsportals.com/,N/A
Grace,Germany,Berlin,"Business Consulting, Accelerator, Female Leadership",No funding announced yet,2017,https://www.grace-accelerator.de/,N/A
Grace Health,Sweden,Stockholm,"FemTech, Digital Health, Healthcare, Reproductive Health",N/A,2017,www.grace.health,N/A
Grace Healthcare,Ireland,Dublin,"Elder Care, Health Care, Nursing and Residential Care",No funding announced yet,2019,https://www.gracehealthcare.ie/,N/A
Gradar,Germany,Düsseldorf,"job evaluation, HR, SaaS",No funding announced yet,2014,https://www.gradar.com/en/index.html,N/A
Gradbase,UK,London,"recruitment, fraud, cv",N/A,2016,www.gradba.se,N/A
Grade Erp,Spain,Madrid,"Unified Business Management, Real-Time Data Insights, Integrated Workflow Automation",Between €100K-€500K,2024,https://grade.app/,Active
Gradesens Ag,Germany,Freiburg,"AI, BigData, IoT, SaaS",Between €1 million-€ 2.5 million,2018,https://www.gradesens.com/es,Active
Gradguide,Ireland,Dublin,"E-Learning, EdTech, Education",No funding announced yet,2019,https://www.gradguide.io/,N/A
Gradient Denervation Technologies,France,Paris,"Biotechnology, Medical Device, Medical Equipment Manufacturing",No funding announced yet,2019,http://www.gradientdenervation.com/,N/A
Gradient Zero,Austria,Vienna,"Differential Privacy, Machine Learning, Privacy-preserving Machine Learning",No funding announced yet,2019,https://gradient0.com,Active
